Condition_ID,Mercado,Lado,Tipo,Traders_Coincidentes,Capital_Visible_USD,Precio_Entrada_Promedio,Precio_Actual_Promedio,Ranking_Mejor,Calidad_Ranking,Peso_Lado,Traders,Peso_Total_Mercado,Capital_Total_Mercado,Traders_Totales_Mercado,Consenso_Neto,Oposicion_Peso,Oposicion_Capital_USD,WCI,Consenso_Porcentaje,Advertencia
0xf5920c054e96c7c7e336f0c90535a1447b5cd9c46c4f908e6e625da56d4c7f63,Segovia: Yi Zhou vs Luka Pavlovic,Luka Pavlovic,Direccional,3,26059.537800000002,0.6148333333333333,0.9994999999999999,1,0.85,189.93994908704386,"RN1, Wallet 0x076d...8d4c, swisstony",189.93994908704386,26059.537800000002,3,1.0,0.0,0.0,70.9,100.0,
0x4580509bd2130de97dc14a002359a70c9ff04d7dc6e637d28d58d1a1d3488ca3,Hamburg European Open: Katarzyna Kawa vs Paula Badosa,Paula Badosa,Direccional,3,43982.7727,0.5839333333333333,0.635,1,0.7666666666666666,207.52881584511198,"Wallet 0x076d...8d4c, Wallet 0x2c33...0563, swisstony",207.52881584511198,43982.7727,3,1.0,0.0,0.0,69.8,100.0,
0x0f5a9a8670cc76629faedf09ed8f64e08b1dad8727b834b31515b01322576b6a,Will FC Seoul win on 2026-07-22?,Yes,Direccional,2,188464.47480000003,0.5354000000000001,0.535,1,0.775,314.83819427841377,"Wallet 0x076d...8d4c, swisstony",358.2760475863294,190351.32190000004,3,0.8787587012847993,43.437853307915645,1886.8471000000136,64.0,87.9,
0x115aa58e9b29210f2f1a6ccffa7d8f6cd1832175f5219f06d16ca4004f5a4d4b,Hamburg European Open: Maria Lourdes Carle vs Anhelina Kalinina,Anhelina Kalinina,Direccional,2,17055.3253,0.9177,0.9925,1,1.0,173.90050913541376,"RN1, swisstony",184.25729435091378,17162.5883,3,0.9437917220483235,10.356785215500025,107.26299999999901,64.0,94.4,
0x0bbc63372aaf0867db23fc361b4e37f7d3125c7acef6cc8e2d5ce40f65b7e523,Boston Red Sox vs. New York Yankees,New York Yankees,Direccional,2,15232.4334,0.49495,0.495,3,0.875,126.74687823386088,"RN1, Wallet 0x2c33...0563",126.74687823386088,15232.4334,2,1.0,0.0,0.0,64.0,100.0,
0x2bfa13bdc10fdec4750bf5285e105b5ec045fee9055e8cdf71056dc8a0aafde7,Livesport Prague Open: Ayla Aksu vs Daria Snigur,Daria Snigur,Direccional,2,8598.8762,0.9547,0.9935,1,1.0,103.21677311078035,"RN1, swisstony",103.21677311078035,8598.8762,2,1.0,0.0,0.0,64.0,100.0,
0x2a792b31e80a16ee597e721ac71b9e9d148b713b763649ea03b8311d733b5ad4,Tampere: Gauthier Onclin vs Niels Visker,Gauthier Onclin,Direccional,2,1239.3219,0.8816999999999999,0.9095,1,1.0,47.3250351245533,"RN1, swisstony",47.3250351245533,1239.3219,2,1.0,0.0,0.0,64.0,100.0,
0xa6f18041a9e4db4936e9da82108169296ade7b2d7c9f0bcf2aec7402db9bfd3b,Baltimore Orioles vs. Boston Red Sox,Boston Red Sox,Direccional,2,756.6574,0.55045,0.555,3,0.875,33.80806274026786,"RN1, Wallet 0x2c33...0563",33.80806274026786,756.6574,2,1.0,0.0,0.0,63.2,100.0,
0xfc20e326d52c24e220a020d6e64a239707b06936e3a5a6c52f559ffab77bba35,Hamburg European Open: Tessa Brockmann vs Elsa Jacquemot,Tessa Brockmann,Direccional,2,12947.874699999998,0.3483,0.375,1,1.0,146.7596233843183,"RN1, swisstony",187.54105298162398,14610.999699999998,3,0.7825466533916624,40.781429597305674,1663.125,62.7,78.3,
0x2c10caa579f60f43e2248157c2c094453096cb1eec4b60e6a54cd1000b51ff03,Generali Open: Alexander Bublik vs Facundo Acosta,Alexander Bublik,Direccional,2,8378.2651,0.6419,0.645,1,0.7,89.03266941933836,"jtwyslljy, swisstony",89.03266941933836,8378.2651,2,1.0,0.0,0.0,62.7,100.0,
0xeaa7e7c6011f5b8196ef0a0180c9f388d37bf5c35f043ed1a2b6a264ffc992d4,Spread: SE Palmeiras (-1.5),Coritiba FBC,Direccional,2,1902.4222,0.75135,0.75,1,0.775,43.053422652067106,"Wallet 0x076d...8d4c, swisstony",43.053422652067106,1902.4222,2,1.0,0.0,0.0,62.4,100.0,
0x19eee811aaeec802a0b1c4f4f20605cb3729c218eb65e6eba6cdd1100bf4362a,Spread: Pohang Steelers FC (-1.5),FC Seoul,Direccional,2,1394.1688000000001,0.93995,0.945,1,0.775,42.60836355281159,"Wallet 0x076d...8d4c, swisstony",42.60836355281159,1394.1688000000001,2,1.0,0.0,0.0,62.0,100.0,
0xfc81f849ae77be28286d8689a4b25e901fa7e18a874d996d03f72a7cdcdd624a,Will Shanghai Shenhua FC vs. Beijing Guoan FC end in a draw?,No,Direccional,2,695.3881,0.76495,0.825,1,0.775,26.640912109705837,"Wallet 0x076d...8d4c, swisstony",26.640912109705837,695.3881,2,1.0,0.0,0.0,61.1,100.0,Revisar reglas: un pick NO puede incluir empate o una resolución distinta a clasificación.
0x6fefc0438c7598b23531457c8c60541990d0786bd4bd9dfc3eabc8d95c291092,"Will Bitcoin reach $250,000 by December 31, 2026?",No,Direccional,2,73684.7681,0.95875,0.9855,30,0.47500000000000003,159.01239512834536,"geniusMC, ndb1",159.01239512834536,73684.7681,2,1.0,0.0,0.0,60.9,100.0,Revisar reglas: un pick NO puede incluir empate o una resolución distinta a clasificación.
0x70a8a51ea6d7eba6d0350a062f1a6451d38fccc137bc1e8f7eb77cffd5ba8e4b,Will Seattle Sounders FC win on 2026-07-22?,No,Direccional,2,521.4058,0.54285,0.555,1,0.775,24.991756050824698,"Wallet 0x076d...8d4c, swisstony",24.991756050824698,521.4058,2,1.0,0.0,0.0,60.8,100.0,Revisar reglas: un pick NO puede incluir empate o una resolución distinta a clasificación.
0xde19280b80c138dc958aa7164bea61094e1ee9641adce20a097a16a98c5ce6a5,ITF Ollersbach: Fares Zakaria vs David Bakonyi,Fares Zakaria,Direccional,2,9022.4998,0.61015,0.935,3,0.775,101.38219670333933,"RN1, Wallet 0x076d...8d4c",122.82794453362028,9482.419899999999,3,0.8254000918788407,21.44574783028095,459.92009999999937,59.1,82.5,
0xe45c9f437b3ddaca31655aa195a4cbab13b41b1a6ab272841314d4397b003261,ITF Ollersbach: Patrik Homola vs Bor Artnak,Bor Artnak,Direccional,2,3668.6073,0.8787,0.9845,3,0.775,66.56128349550562,"RN1, Wallet 0x076d...8d4c",77.33833782403157,3784.7522,3,0.860650556609491,10.77705432852595,116.14489999999978,59.0,86.1,
0x2f39c668afc7b19d558be8de8e28006b0c53b5ccb0543fe3226c115eaea6a693,Hamburg European Open: Simona Waltert vs Mayar Sherif,Mayar Sherif,Direccional,3,12279.139500000001,0.5623,0.575,1,0.85,145.56242733776287,"RN1, Wallet 0x076d...8d4c, swisstony",245.9345149559825,18616.1714,5,0.591874740980605,100.37208761821964,6337.031899999998,57.7,59.2,
0xfa086a518e7f6045b17e542de8fbab13f20b19fbbbcf05c3e26e78540c48b38d,Generali Open: Kilian Feldbausch vs Ignacio Buse,Ignacio Buse,Direccional,2,1705.5859,0.6628000000000001,0.6795,1,0.775,39.27323860243955,"Wallet 0x076d...8d4c, swisstony",46.42786133882475,1874.8045,3,0.8458980764982549,7.1546227363852,169.21859999999992,57.6,84.6,
0x055ae2ce1a9d54d1230b0ec51a3ba2c872544209e3dcc98d38fa2b0453fa278f,Will PFK Levski Sofia win on 2026-07-22?,Yes,Direccional,2,22980.4842,0.43655,0.475,3,0.775,108.60518791153338,"RN1, Wallet 0x076d...8d4c",148.8880188355139,28344.803099999997,3,0.7294420918550637,40.28283092398051,5364.318899999998,57.3,72.9,
0x61af2cc3b324cbd876ebfc4b76c98c9c5e86a7e82d097a85f07f24953626af9c,Generali Open: Quentin Halys vs Valentin Vacherot,Quentin Halys,Direccional,2,8522.0568,0.51725,0.635,1,1.0,114.27676723837436,"RN1, swisstony",191.58904437674303,13345.3199,5,0.5964681728547021,77.31227713836867,4823.2631,56.6,59.6,
0x305d7c3d8e2961e20ccd787118c5934bef98bc2ad9e3b55a0ab8a573371bd6eb,Generali Open: Sebastian Baez vs Arthur Rinderknech,Sebastian Baez,Direccional,3,1831.7491,0.5211333333333333,0.655,1,0.85,64.83760639171433,"RN1, Wallet 0x076d...8d4c, swisstony",129.79407477477972,5520.9155,6,0.4995421131836823,64.95646838306538,3689.1664,52.6,50.0,
0xf330a9c9053053882f094c3cd3dd63984f7a6a32ca94a933eb0094fce730b788,Livesport Prague Open: Marie Bouzkova vs Carol Young Suh Lee,Marie Bouzkova,Direccional,2,2193.5582,0.79495,0.845,1,0.775,53.442959218619,"Wallet 0x076d...8d4c, swisstony",80.17981019250895,2908.4174,3,0.6665388592253375,26.73685097388995,714.8591999999999,52.5,66.7,
0x2f39c668afc7b19d558be8de8e28006b0c53b5ccb0543fe3226c115eaea6a693,Hamburg European Open: Simona Waltert vs Mayar Sherif,Simona Waltert,Direccional,2,6337.0319,0.41969999999999996,0.425,1,1.0,100.37208761821964,"RN1, swisstony",245.9345149559825,18616.1714,5,0.408125259019395,145.56242733776287,12279.1395,50.6,40.8,
0x61af2cc3b324cbd876ebfc4b76c98c9c5e86a7e82d097a85f07f24953626af9c,Generali Open: Quentin Halys vs Valentin Vacherot,Valentin Vacherot,Direccional,3,4823.2631,0.49833333333333335,0.365,1,0.7999999999999999,77.31227713836867,"RN1, jtwyslljy, swisstony",191.58904437674303,13345.3199,5,0.40353182714529784,114.27676723837436,8522.0568,49.9,40.4,
0xa5e1eec9ea183ebdea91adfa0303bdacc3d7798e11da798467535b1c1764b74d,ITF Bacau: Stefan Ilie Bogdan Petre vs Stefan Adrian Andreescu,Stefan Adrian Andreescu,Direccional,2,544.6203,0.6344000000000001,0.72,3,0.775,25.007873191133186,"RN1, Wallet 0x076d...8d4c",39.937809560722975,767.5233000000001,3,0.6261703750454881,14.92993636958979,222.90300000000002,49.6,62.6,
0x305d7c3d8e2961e20ccd787118c5934bef98bc2ad9e3b55a0ab8a573371bd6eb,Generali Open: Sebastian Baez vs Arthur Rinderknech,Arthur Rinderknech,Direccional,3,3689.1664,0.4616,0.3449,3,0.65,64.95646838306538,"RN1, Wallet 0x076d...8d4c, jtwyslljy",129.79407477477972,5520.9155,6,0.5004578868163178,64.83760639171433,1831.7491,49.5,50.0,
0xcabd45bbac7facb7980779e2ac69dc1a910829ca3a946b8341ad11b532d9a512,Generali Open: Alex Molcan vs Daniel Altmaier,Alex Molcan,Direccional,2,609.5332,0.5562,0.5649,1,0.775,28.17400720466466,"Wallet 0x076d...8d4c, swisstony",54.555819121210504,4959.5332,3,0.5164253357110904,26.381811916545843,4350.0,46.5,51.6,
0x4b1205f15acbe056307f5fc5d6022808f0a2a10f67a3f61cbb59edd821cc823a,Will Viking FK win on 2026-05-30?,No,Direccional,2,386.9133,0.55495,0.5635,1,0.775,22.358307053857267,"Wallet 0x076d...8d4c, swisstony",45.151564828909954,906.4458999999999,3,0.49518343691028704,22.793257775052687,519.5326,45.3,49.5,Revisar reglas: un pick NO puede incluir empate o una resolución distinta a clasificación.
0x16c63b7cc37f012b9f59ee164ec03877914c701d06d48291ae8d6fc08a088b0d,"2026 Balance of Power: D Senate, D House",No,Direccional,1,4521461.193,0.5,0.5649,13,0.75,1594.7795838492855,Wallet 0x2c33...0563,2994.2364213468736,8003202.4197,2,0.5326164535571037,1399.4568374975881,3481741.2267000005,45.0,53.3,Revisar reglas: un pick NO puede incluir empate o una resolución distinta a clasificación.
0x16c63b7cc37f012b9f59ee164ec03877914c701d06d48291ae8d6fc08a088b0d,"2026 Balance of Power: D Senate, D House",Yes,Direccional,1,3481741.2267,0.5,0.435,13,0.75,1399.456837497588,Wallet 0x2c33...0563,2994.2364213468736,8003202.4197,2,0.46738354644289626,1594.7795838492857,4521461.193,45.0,46.7,
0x86bfb53af7250a40928975c551d12c185b762fa4ce0b40c6a64a50c946d72587,Will the Republican Party control the Senate after the 2026 Midterm elections?,Yes,Direccional,1,1054500.0,0.5,0.555,30,0.55,564.7886772944373,ndb1,1070.5195840027382,1900000.0,2,0.527583694622996,505.73090670830084,845500.0,45.0,52.8,
0x86bfb53af7250a40928975c551d12c185b762fa4ce0b40c6a64a50c946d72587,Will the Republican Party control the Senate after the 2026 Midterm elections?,No,Direccional,1,845500.0,0.5,0.445,30,0.55,505.73090670830084,ndb1,1070.5195840027382,1900000.0,2,0.472416305377004,564.7886772944373,1054500.0,45.0,47.2,Revisar reglas: un pick NO puede incluir empate o una resolución distinta a clasificación.
0x86e8f678e6cebb9596ffbb5a736b2ff9f36b12905d5b65b1556329c28533c7a1,Will Manchester City win the 2026-27 English Premier League (EPL) Championship?,No,Direccional,1,201938.6409,0.7,0.705,30,0.55,247.15670913865563,ndb1,247.15670913865563,201938.6409,1,1.0,0.0,0.0,45.0,100.0,Revisar reglas: un pick NO puede incluir empate o una resolución distinta a clasificación.
0x26f410f7518fa199678ef57f02637fc88be9b3b593346b00946d7ea451f4521b,Will Ousmane Dembélé win the 2026 Ballon d'Or?,No,Direccional,1,86885.9428,0.9568,0.9835,30,0.55,162.12031858160162,ndb1,162.12031858160162,86885.9428,1,1.0,0.0,0.0,45.0,100.0,Revisar reglas: un pick NO puede incluir empate o una resolución distinta a clasificación.
0x18076e7d0f58a52d3d4f311d0456306edf16d1873cf5eef27d3ff044153e9576,"Bitcoin all time high by December 31, 2026?",No,Direccional,1,84844.5825,0.8565,0.942,30,0.55,160.20451368875348,ndb1,160.20451368875348,84844.5825,1,1.0,0.0,0.0,45.0,100.0,Revisar reglas: un pick NO puede incluir empate o una resolución distinta a clasificación.
0x02deb9538f5c123373adaa4ee6217b01745f1662bc902e46ac92f3fe6f8741e8,"Will Bitcoin hit $150k by December 31, 2026?",No,Direccional,1,82336.9287,0.9038,0.9615,30,0.55,157.8192666683951,ndb1,157.8192666683951,82336.9287,1,1.0,0.0,0.0,45.0,100.0,Revisar reglas: un pick NO puede incluir empate o una resolución distinta a clasificación.
0xa4ddc18895cc7b14810283ef8f113939abffd3969c6a0e37f1897110c67e6f73,Hantavirus pandemic in 2026?,No,Direccional,1,80481.9392,0.9119,0.9655,15,0.75,212.77004206419662,Wallet 0x006c...16ea,212.77004206419662,80481.9392,1,1.0,0.0,0.0,45.0,100.0,Revisar reglas: un pick NO puede incluir empate o una resolución distinta a clasificación.
0xc0b7319f73f248310b059c231fb069e64dbd68ca81dd9933728ca192b54c3cc4,Will Trump be in the WC Champions Photo?,Yes,Direccional,1,63364.353,0.8967,0.9985,13,0.75,188.7920775946385,Wallet 0x2c33...0563,188.7920775946385,63364.353,1,1.0,0.0,0.0,45.0,100.0,
0x472c9035786b390c08e674fc60bddda488957e1b8aecad3f5480cc531a0754b0,"Will Bitcoin reach $160,000 by December 31, 2026?",No,Direccional,1,41822.468,0.9449,0.9715,30,0.55,112.47798260104065,ndb1,112.47798260104065,41822.468,1,1.0,0.0,0.0,45.0,100.0,Revisar reglas: un pick NO puede incluir empate o una resolución distinta a clasificación.
0x6123b5cc75c38ba9783f6c8ea260107b546c7d3454a8f9b5280c9921cc39f3d9,"Bitcoin all time high by September 30, 2026?",No,Direccional,1,35439.0909,0.9574,0.9845,30,0.55,103.53900229985801,ndb1,103.53900229985801,35439.0909,1,1.0,0.0,0.0,45.0,100.0,Revisar reglas: un pick NO puede incluir empate o una resolución distinta a clasificación.
0xac32e73aa9e0dae801d88d4f81efd2ef3fa0f04b815f3a0e74426f0762e668cd,"Will Bitcoin reach $200,000 by December 31, 2026?",No,Direccional,1,30212.7839,0.9656,0.9785,30,0.55,95.60003728948018,ndb1,95.60003728948018,30212.7839,1,1.0,0.0,0.0,45.0,100.0,Revisar reglas: un pick NO puede incluir empate o una resolución distinta a clasificación.
0xe71b9d788ce662d967ff2c90749ff8b26cee290455ef6cb84f33d1393ffae115,"Will Bitcoin reach $190,000 by December 31, 2026?",No,Direccional,1,29295.0037,0.9654,0.9765,30,0.55,94.13680799373857,ndb1,94.13680799373857,29295.0037,1,1.0,0.0,0.0,45.0,100.0,Revisar reglas: un pick NO puede incluir empate o una resolución distinta a clasificación.
0x799c35de1e5f3ebd75053643e020e6df9e9a3f477e3d6066eb0a8565f65d547f,"Will Bitcoin reach $180,000 by December 31, 2026?",No,Direccional,1,24650.2231,0.9663,0.9775,30,0.55,86.35214234603565,ndb1,86.35214234603565,24650.2231,1,1.0,0.0,0.0,45.0,100.0,Revisar reglas: un pick NO puede incluir empate o una resolución distinta a clasificación.
0x29d203f90b02392439bb3f919af6bee4589c747ed655e05a89fdfa274404a828,Will Charlotte FC win on 2026-07-22?,No,Direccional,1,21150.0318,0.5181,0.525,28,0.55,79.9867777792055,Wallet 0x076d...8d4c,97.75189809965366,21465.6313,2,0.8182631676129969,17.765120320448162,315.59950000000026,45.0,81.8,Revisar reglas: un pick NO puede incluir empate o una resolución distinta a clasificación.
0x8d8e0630bd63491f2a77d1e0fb0f2750ec4ff118151bade96b00700813d7c467,St. Louis Cardinals vs. Cincinnati Reds,St. Louis Cardinals,Direccional,1,19587.6257,0.4212,0.415,30,0.55,76.97568950162123,ndb1,76.97568950162123,19587.6257,1,1.0,0.0,0.0,45.0,100.0,
0x9affeb38bce1e9a6de30e9ecada1ecfaf636574d3961cf3b9177299786214234,"Will Bitcoin reach $170,000 by December 31, 2026?",No,Direccional,1,19510.5789,0.9519,0.9775,30,0.55,76.82415061196578,ndb1,76.82415061196578,19510.5789,1,1.0,0.0,0.0,45.0,100.0,Revisar reglas: un pick NO puede incluir empate o una resolución distinta a clasificación.
0x2745c38ff0617cb345c1d2df19b4f74ea777508e07411e88eeb6ab3affcda2a2,"Will Bitcoin dip to $35,000 by December 31, 2026?",No,Direccional,1,18096.1356,0.85,0.905,13,0.75,100.89140833093768,Wallet 0x2c33...0563,100.89140833093768,18096.1356,1,1.0,0.0,0.0,45.0,100.0,Revisar reglas: un pick NO puede incluir empate o una resolución distinta a clasificación.
0x7e8f8596bceba09095a584e6f2ce3a0df89ae90890ac2013756941531a1e60b5,MLB: Aaron Judge or Juan Soto to draw more walks?,Soto,Direccional,1,13828.5538,0.2719,0.905,30,0.55,64.677179317747,ndb1,64.677179317747,13828.5538,1,1.0,0.0,0.0,45.0,100.0,
0xe85d65538ebcf8bd8adb2397657946a5a1638e4cc806eef37138ca12058d3a45,Will Tromsø IL win on 2026-07-23?,Yes,Direccional,1,12257.4071,0.5738,0.625,28,0.55,60.89224620384767,Wallet 0x076d...8d4c,60.89224620384767,12257.4071,1,1.0,0.0,0.0,45.0,100.0,
0x6915eebfc4e59a01872275bae229f78a65316401d356f0473848d4a2d178a38e,Will NK Celje win on 2026-07-22?,Yes,Direccional,1,11967.4093,0.4316,0.495,28,0.55,60.16761016734835,Wallet 0x076d...8d4c,96.89230825324145,16425.9331,2,0.6209740613268494,36.7246980858931,4458.523799999999,45.0,62.1,
0x3e9646ce87a96f3e3f972e9267e742969ceb6c1998c3a7f7395bd691d7c26970,ITF Bacau: Tudor Batin vs Oleksandr Ovcharenko,Tudor Batin,Direccional,1,11854.9552,0.4561,0.9995,3,1.0,108.88046289394622,RN1,108.88046289394622,11854.9552,1,1.0,0.0,0.0,45.0,100.0,
0xd3eb5bac621abdcd1a703380558c76c6e162330000f2f733065740b3c554a6df,Will Universitatea Craiova CS win on 2026-07-22?,No,Direccional,1,11032.1805,0.7162,0.765,28,0.55,57.76880301036192,Wallet 0x076d...8d4c,57.76880301036192,11032.1805,1,1.0,0.0,0.0,45.0,100.0,Revisar reglas: un pick NO puede incluir empate o una resolución distinta a clasificación.
0x75abb5b9b5ef0ed3f468be0b91559f2a413b750b4a7a1744151ae229df97eded,St. Louis Cardinals vs. Cincinnati Reds: O/U 9.5,Over,Direccional,1,10489.0826,0.52,0.605,32,0.55,56.32892229130609,LaBradfordSmith22,56.32892229130609,10489.0826,1,1.0,0.0,0.0,45.0,100.0,
0x09b9f51bd1767cd5429c18092e8e1d03370831e777eaa8219e6a90febe66172a,Spread: St. Louis Cardinals (-1.5),Cincinnati Reds,Direccional,1,9361.5123,0.5616,0.705,30,0.55,53.21519962144275,ndb1,53.21519962144275,9361.5123,1,1.0,0.0,0.0,45.0,100.0,
0x3d7a975be54b6a10a0ed071f12d4fed157e7e01c11da5f585ece547917f71d38,Will Qarabağ Ağdam FK win on 2026-07-23?,Yes,Direccional,1,9311.4869,0.5212,0.635,28,0.55,53.07282531814187,Wallet 0x076d...8d4c,53.07282531814187,9311.4869,1,1.0,0.0,0.0,45.0,100.0,
0xfee04bc13ce1c0a8e9fe32e40807caddf82da5a8f096fc94451ad98850b10373,Will Houston Dash win on 2026-07-24?,Yes,Direccional,1,5589.0121,0.3119,0.355,28,0.55,41.11783263074551,Wallet 0x076d...8d4c,41.11783263074551,5589.0121,1,1.0,0.0,0.0,45.0,100.0,
0x9c91ff4f3a8e2ab69650e8677be80643b2494260d1dedabb1403e06968e9e975,Spread: PFK Levski Sofia (-1.5),PFK Levski Sofia,Direccional,1,4860.0,0.21,0.225,3,1.0,69.7137002317335,RN1,69.7137002317335,4860.0,1,1.0,0.0,0.0,45.0,100.0,
0x1ec965182c194a5054a73c8e1cd0cc23eacb7c99eee0da8621727095ad7af8e4,ITF Denia: Pablo Perez Navarro vs Michiel De Krom,Michiel De Krom,Direccional,1,4812.9693,0.818,0.9995,3,1.0,69.37556702470978,RN1,69.37556702470978,4812.9693,1,1.0,0.0,0.0,45.0,100.0,
0x903cf32001c2571b1bcc28f69de843cf99e4a6918d85111b2051ecbf0d457018,ITF Brisbane: Natsuho Arakawa vs Lily Fairclough,Natsuho Arakawa,Direccional,1,4537.7362,0.3183,0.9995,3,1.0,67.36272114456185,RN1,67.36272114456185,4537.7362,1,1.0,0.0,0.0,45.0,100.0,
0x407a57edbe2b72c403cfee2c0f43e4b54f1b70a2531c7ad598849c3a70c2ad99,Will Han Feng Win the 2026 WSOP Main Event?,No,Direccional,1,4510.4907,0.9345,0.93,30,0.55,36.93810277680759,ndb1,36.93810277680759,4510.4907,1,1.0,0.0,0.0,45.0,100.0,Revisar reglas: un pick NO puede incluir empate o una resolución distinta a clasificación.
0xd8b32c29b7507ccdf3d1ef0b705abc5a46944eeefe7f8ba9f86a7932e7bfb971,ITF Denia: Ludvig Fredrik Hede vs Herman Hoeyeraal,Ludvig Fredrik Hede,Direccional,1,4372.9379,0.4518,0.71,3,1.0,66.1281929285838,RN1,121.47651178290855,7436.3742999999995,2,0.5443701992922049,55.348318854324745,3063.4363999999996,45.0,54.4,
0xffa06c7df97bd5ebbc803b8187d4a5d1d73f19595fb2d2c6057a68562604e2b2,ITF Kursumlijska Banja: Felitsata Dorofeeva-Rybas vs Marianne Argyrokastriti,Marianne Argyrokastriti,Direccional,1,3603.6466,0.181,0.635,3,1.0,60.03038064180503,RN1,104.66253721080805,5595.6759999999995,2,0.5735612974955279,44.63215656900302,1992.0293999999994,45.0,57.4,
0x9d456843ff5ed939ed9b4c4be65c3b35276850e959e71f85a6d474a74abebb9f,Will Kansas City Current win on 2026-07-25?,Yes,Direccional,1,3481.4144,0.3794,0.465,28,0.55,32.45193146794194,Wallet 0x076d...8d4c,32.45193146794194,3481.4144,1,1.0,0.0,0.0,45.0,100.0,
0xcd5449ca40141b5830448d8845deda651e61696e2d03c0dc010c261fd146ccf6,ITF Kursumlijska Banja: Andrea Obradovic vs Maria Golovina,Andrea Obradovic,Direccional,1,3468.8892,0.1259,0.9995,3,1.0,58.8972766772794,RN1,58.8972766772794,3468.8892,1,1.0,0.0,0.0,45.0,100.0,
0xba9987738b849610b4f2e9aa67a07434c891e3e9254dde20aa87af894de74c86,Bucheon FC 1995 vs. FC Anyang: Both Teams to Score,Yes,Direccional,1,3384.0937,0.5046,0.535,1,1.0,58.17296365151083,swisstony,78.5329955768296,3798.6246,2,0.7407455073402828,20.36003192531878,414.5309000000002,45.0,74.1,
0x895e01dbf3e6a33cd9a44ca0f8cdb5df1bd2b0b6ebed5300d28f8da7145145e4,Will Donald Trump win the 2028 Republican presidential nomination?,Yes,Direccional,1,3356.792,0.0402,0.0135,16,0.75,43.45337156078916,beachboy4,43.45337156078916,3356.792,1,1.0,0.0,0.0,45.0,100.0,
0x304d3f57b6c1f7f2056a596136d2b42b17c6139eff37e1c4a17d369e26e0d20c,Spread: Coritiba FBC (-2.5),SE Palmeiras,Direccional,1,3077.8799,0.9809,0.9805,1,1.0,55.47864363879131,swisstony,55.47864363879131,3077.8799,1,1.0,0.0,0.0,45.0,100.0,
0xd8b32c29b7507ccdf3d1ef0b705abc5a46944eeefe7f8ba9f86a7932e7bfb971,ITF Denia: Ludvig Fredrik Hede vs Herman Hoeyeraal,Herman Hoeyeraal,Direccional,1,3063.4364,0.6682,0.29,3,1.0,55.348318854324745,RN1,121.47651178290855,7436.3742999999995,2,0.45562980070779513,66.1281929285838,4372.937899999999,45.0,45.6,
0x983aafe2560d2e3987a2ecbeb022c364160c03ead3543d607e0aa2313006d2aa,Spread: St. Louis Cardinals (-1.5),St. Louis Cardinals,Direccional,1,3038.4585,0.3894,0.335,1,1.0,55.12221421532339,swisstony,71.35757685371246,3302.0455,2,0.7724787842547879,16.23536263838907,263.587,45.0,77.2,
0xe326d1abf5fb59b82ecfdff3348e75f90561eace327ba1bdc8d38d045ddbe775,"Will Bitcoin dip to $25,000 by December 31, 2026?",No,Direccional,1,2837.4291,0.92,0.955,13,0.75,39.95064290784317,Wallet 0x2c33...0563,39.95064290784317,2837.4291,1,1.0,0.0,0.0,45.0,100.0,Revisar reglas: un pick NO puede incluir empate o una resolución distinta a clasificación.
0x1af1af3bdc91a70599c5e2301b9b720811d2a09811149dc8301c8f8a0454364f,Spread: FC Anyang (-1.5),Bucheon FC 1995,Direccional,1,2782.4503,0.8417,0.845,1,1.0,52.74893648216995,swisstony,67.77383248846564,3008.1978,2,0.7783083019710777,15.024896006295691,225.74749999999995,45.0,77.8,
0x9fdd54ac2cb3d12f4bbb385357cdb899ebb5a00d958ca37e5139abd52b1f667f,Will FCSB win on 2026-07-23?,Yes,Direccional,1,2763.9857,0.7343,0.785,28,0.55,28.915491942036887,Wallet 0x076d...8d4c,28.915491942036887,2763.9857,1,1.0,0.0,0.0,45.0,100.0,
0xdee53c872dfc5f633345aa8e953958961e3d2daf3aabed82a715f8a42ee33875,Exact Score: Chicago Fire FC 0 - 2 Vancouver Whitecaps FC?,No,Marcador exacto / posible cobertura,1,2670.9451,0.95,0.71,1,1.0,51.68118709936915,swisstony,51.68118709936915,2670.9451,1,1.0,0.0,0.0,45.0,100.0,Revisar reglas: un pick NO puede incluir empate o una resolución distinta a clasificación.
0x0da3005f7d57b33cac257bcd4633611dd601709d2fa8bcb55749a98a3114d99f,Tampa Bay Rays vs. New York Yankees,Tampa Bay Rays,Direccional,1,2418.211,0.4081,0.41,30,0.55,27.046419864743655,ndb1,27.046419864743655,2418.211,1,1.0,0.0,0.0,45.0,100.0,
0x84fa88ba8ae4d2acb91b42922112bb9f01f6f4541495276aec57a552861fa158,Will Orlando Pride win on 2026-07-24?,Yes,Direccional,1,2397.1417,0.6076,0.62,28,0.55,26.928337569371045,Wallet 0x076d...8d4c,26.928337569371045,2397.1417,1,1.0,0.0,0.0,45.0,100.0,
0xfb8b836963e2222c6968255cefdf6802981fce530b089fc05c2be19d73f6d754,ITF Denia: Thomas Miranda vs Eric Vanshelboim,Eric Vanshelboim,Direccional,1,2286.5091,0.9007,0.9995,3,1.0,47.81745601765113,RN1,47.81745601765113,2286.5091,1,1.0,0.0,0.0,45.0,100.0,
0xf194634652d8dbdb464a85ef173ca2d037cc6d488d547da4b56aace7b5b3a6ec,Will Bohemian FC win on 2026-07-22?,Yes,Direccional,1,2286.0576,0.5174,0.555,28,0.55,26.29700408791846,Wallet 0x076d...8d4c,33.47665529810966,2456.4622,2,0.7855326003671395,7.179651210191203,170.40459999999985,45.0,78.6,
0x97b66d987b63b438af6467bf15ede9f2845b857dadf44653b262fc5a6a699411,Will SE Palmeiras win on 2026-07-22?,Yes,Direccional,1,2285.3455,0.5121,0.515,1,1.0,47.80528736447465,swisstony,58.85679857335464,2407.4814,2,0.8122305073201319,11.051511208879987,122.13590000000022,45.0,81.2,
0x1de9c5878cc635684c5f3b426b467f8b997bb5f95b6232d22c3cda294eca4156,ITF Sao Paulo: Juan Estevez vs Joao Vitor Scramin Do Lago,Juan Estevez,Direccional,1,2284.8141,0.9697,0.966,28,0.55,26.28985099330158,Wallet 0x076d...8d4c,26.28985099330158,2284.8141,1,1.0,0.0,0.0,45.0,100.0,
0x1b73df257cad3519bb52e269583d7ba4312d48c336f24063606824af758d0710,Baltimore Orioles vs. Boston Red Sox: O/U 9.5,Over,Direccional,1,2175.0,0.43,0.435,3,1.0,46.636895265444075,RN1,46.636895265444075,2175.0,1,1.0,0.0,0.0,45.0,100.0,
0xd639ab51a4ff3c0359c4a0bbc05283f088524c007692746778cd2618236859ec,Arizona Diamondbacks vs. St. Louis Cardinals,Arizona Diamondbacks,Direccional,1,2171.3192,0.4302,0.455,3,1.0,46.597416237383804,RN1,46.597416237383804,2171.3192,1,1.0,0.0,0.0,45.0,100.0,
0xd71197329e1145258b960c36269870229ee816b0aa089e8f1b64ea196d7e2d08,Will Africa (CAF) win the 2026 FIFA World Cup?,No,Direccional,1,2139.5026,0.925,1.0,20,0.75,34.69106819485384,DrPufferfish,34.69106819485384,2139.5026,1,1.0,0.0,0.0,45.0,100.0,Revisar reglas: un pick NO puede incluir empate o una resolución distinta a clasificación.
0xffa06c7df97bd5ebbc803b8187d4a5d1d73f19595fb2d2c6057a68562604e2b2,ITF Kursumlijska Banja: Felitsata Dorofeeva-Rybas vs Marianne Argyrokastriti,Felitsata Dorofeeva-Rybas,Direccional,1,1992.0294,0.5353,0.365,3,1.0,44.63215656900302,RN1,104.66253721080805,5595.6759999999995,2,0.42643870250447213,60.03038064180503,3603.6465999999996,45.0,42.6,
