Condition_ID,Mercado,Lado,Tipo,Traders_Coincidentes,Capital_Visible_USD,Precio_Entrada_Promedio,Precio_Actual_Promedio,Ranking_Mejor,Calidad_Ranking,Peso_Lado,Traders,Peso_Total_Mercado,Capital_Total_Mercado,Traders_Totales_Mercado,Consenso_Neto,Oposicion_Peso,Oposicion_Capital_USD,WCI,Consenso_Porcentaje,Advertencia
0xc0911c287fe67a2b099630e2d73e1cb7ab83491bb81e2c3f2610bc8890ba3418,ITF Las Palmas: Carlota Corte vs Silvia Bosch Armas,Carlota Corte,Direccional,1,446.1833,0.88,0.95,1,1.0,21.123051389418148,swisstony,21.123051389418148,446.1833,1,1.0,0.0,0.0,45.0,100.0,
0xdba407e4d00e67b63d25923eb01a1043bedc5bb92387f840d4e3d17dd6f293c3,MLB: Scorigami in 2026?,No,Direccional,1,443.756,0.85,0.8845,30,0.55,11.586034265442166,ndb1,11.586034265442166,443.756,1,1.0,0.0,0.0,45.0,100.0,Revisar reglas: un pick NO puede incluir empate o una resolución distinta a clasificación.
0x0b3062e777ef1ef4308c80016fcb7ca1dfc6a32aceaf54b8f30a41631af2d9a8,ITF Amstetten: Julie Pastikova vs Franziska Sziedat,Franziska Sziedat,Direccional,1,441.9096,0.2391,0.11,3,1.0,21.021645986934516,RN1,21.021645986934516,441.9096,1,1.0,0.0,0.0,45.0,100.0,
0x80caefc0951fd4ec43f3206de1e8b14a9a93c9eceaa8eb8abdead387137e7870,Counter-Strike: Nemiga vs G2 (BO3) - BLAST Bounty Qualifier,G2,Direccional,1,433.2463,0.8499,0.845,28,0.55,11.448013179150347,Wallet 0x076d...8d4c,11.448013179150347,433.2463,1,1.0,0.0,0.0,45.0,100.0,
0xc91fe0649a963a53ffb209bbe750846dcf373b2ec9d15a21493bb550c3e9ed46,Will HNK Hajduk Split win on 2026-07-23?,No,Direccional,1,431.5705,0.5746,0.5649,28,0.55,11.42585122649512,Wallet 0x076d...8d4c,11.42585122649512,431.5705,1,1.0,0.0,0.0,45.0,100.0,Revisar reglas: un pick NO puede incluir empate o una resolución distinta a clasificación.
0x97954cb222b1b873fb98e88bce8f9f9544dd45c253ea99474ab4a2d1bd4a42b9,KBO: KT Wiz vs. Samsung Lions,KT Wiz,Direccional,1,430.4,0.53,0.5995,1,1.0,20.746083967823903,swisstony,20.746083967823903,430.4,1,1.0,0.0,0.0,45.0,100.0,
0xf0681ed8d200cf0fce0d3b41d1fb7f62ed24224a445472a51295b73a26236ace,Toronto Blue Jays vs. Chicago Cubs: O/U 4.5,Over,Direccional,1,418.2,0.7681,0.82,1,1.0,20.449938875214272,swisstony,20.449938875214272,418.2,1,1.0,0.0,0.0,45.0,100.0,
0x8f9f849264850e9ef28351b19c67edad33e8762267bd2e12acf7f9da2a4fec34,Detroit Tigers vs. Cleveland Guardians: O/U 10.5,Under,Direccional,1,418.1094,0.775,0.74,1,1.0,20.447723589681075,swisstony,20.447723589681075,418.1094,1,1.0,0.0,0.0,45.0,100.0,
0x81c53b71a9724cef4128edc63fd8238a53e78322909c0fe1659fa3c60f43bacb,ITF Amstetten: Anna Siskova vs Aneta Kucmova,Anna Siskova,Direccional,1,400.9579,0.52,0.505,28,0.55,11.013163249039762,Wallet 0x076d...8d4c,11.013163249039762,400.9579,1,1.0,0.0,0.0,45.0,100.0,
0x6a018e86c3e2a35d32e53645fc0e884482e95056e08f357dfda54213fabfdf8c,Nashville SC vs. CF Montréal: CF Montréal O/U 2.5,Under,Direccional,1,400.3259,0.9299,0.925,1,1.0,20.008145841131807,swisstony,20.008145841131807,400.3259,1,1.0,0.0,0.0,45.0,100.0,
0x403b4ed91ef07fe0d7f0c5210e9562abd770c5b79a84cbbe45688f7472ef0d4d,Columbus Crew vs. New York City FC: O/U 3.5,Under,Direccional,1,400.04,0.6899,0.685,1,1.0,20.00099997500125,swisstony,20.00099997500125,400.04,1,1.0,0.0,0.0,45.0,100.0,
0xe06fefdae79803caa08de8346118721082a6239d0101022efce3db6eaf31f892,Will FK Borac Banja Luka win on 2026-07-23?,Yes,Direccional,1,397.6094,0.5666,0.665,28,0.55,10.9670799896782,Wallet 0x076d...8d4c,10.9670799896782,397.6094,1,1.0,0.0,0.0,45.0,100.0,
0xb560a07df7c13ede1fdd89b0df6b34d741e9ede4dec8450d6404105c3aa4e064,HNK Hajduk Split vs. Páfos FC: Both Teams to Score,Yes,Direccional,1,383.7983,0.5091,0.495,28,0.55,10.774923932446113,Wallet 0x076d...8d4c,10.774923932446113,383.7983,1,1.0,0.0,0.0,45.0,100.0,
0xf212bd2891f0e33a1c16730bd8980c69ffd9d0eca10b43191b73dac023262fed,Will Oceania (OCF) win the 2026 FIFA World Cup?,No,Direccional,1,380.8519,0.98,1.0,20,0.75,14.636570423087505,DrPufferfish,14.636570423087505,380.8519,1,1.0,0.0,0.0,45.0,100.0,Revisar reglas: un pick NO puede incluir empate o una resolución distinta a clasificación.
0x174b1224d4226b0c0c6d0ffcb8c12421d70e9b948378ff031180e5bd5b5821f3,Will Taylor Ward lead the MLB in RBIs for the 2026 regular season?,No,Direccional,1,372.1444,0.9757,0.992,30,0.55,10.6100745049222,ndb1,10.6100745049222,372.1444,1,1.0,0.0,0.0,45.0,100.0,Revisar reglas: un pick NO puede incluir empate o una resolución distinta a clasificación.
0x20e567cf42b61e1e7ffe3ced87b36a03e77862e59f0d3b8cc9c656d17e6c7fd3,ITF Huamantla: Isabella Foshee vs Mika Buchnik,Mika Buchnik,Direccional,1,366.3558,0.7997,0.795,28,0.55,10.527232756047528,Wallet 0x076d...8d4c,10.527232756047528,366.3558,1,1.0,0.0,0.0,45.0,100.0,
0x706da086a4ce7b326ab0ace3d03d1bc2d5ca3a129a6c56984103e25008ff2c5a,Gwangju FC vs. Gimcheon Sangmu FC: Gwangju FC O/U 1.5,Over,Direccional,1,364.0304,0.2309,0.525,1,1.0,19.079580708181194,swisstony,19.079580708181194,364.0304,1,1.0,0.0,0.0,45.0,100.0,
0x11e3e3fab6e2b24be16f399fbfd24a41fda94e2a2bfbdef31c724e1c56ac864e,Shanghai Haigang FC vs. Dalian Yingbo FC: Dalian Yingbo FC O/U 0.5,Over,Direccional,1,352.6889,0.7397,0.4,1,1.0,18.78001331202936,swisstony,18.78001331202936,352.6889,1,1.0,0.0,0.0,45.0,100.0,
0xd6df30720280e963b4294c71f0ab72b85c1426bfdacdc3223d2a64002308efca,Will Zirə FK win on 2026-07-23?,Yes,Direccional,1,342.7247,0.5796,0.735,28,0.55,10.18205390626076,Wallet 0x076d...8d4c,10.18205390626076,342.7247,1,1.0,0.0,0.0,45.0,100.0,
0x50fc8b640d85037e37c72902432f6c69f7fa2cee117f1ab821ba4b1aa3426e93,Braunschweig: Martin Krumich vs Francisco Comesana,Francisco Comesana,Direccional,1,341.24,0.5,0.5,3,1.0,18.472682533947257,RN1,18.472682533947257,341.24,1,1.0,0.0,0.0,45.0,100.0,
0xcf28c08fee8c8ea3407eb1d263f02333b2b844003ca6cbf6fef6b6b5ed889531,Will San Jose Earthquakes win on 2026-07-22?,No,Direccional,1,329.2702,0.3695,0.375,1,1.0,18.145803922670385,swisstony,18.145803922670385,329.2702,1,1.0,0.0,0.0,45.0,100.0,Revisar reglas: un pick NO puede incluir empate o una resolución distinta a clasificación.
0xfc5ec7c71cb3cb900767ba98af98327120f0c786b6d49c0280913ab8e20b38ed,ITF Denia: Oscar Jose Gutierrez vs Sergio Planella Hernandez,Sergio Planella Hernandez,Direccional,1,326.55,0.1346,0.375,3,1.0,18.070694507959566,RN1,33.19390845209195,555.2616,2,0.544397913672643,15.123213944132381,228.71160000000003,45.0,54.4,
0x70a8456e1acbb925262f0784503644ae6bdd70cf3c9be375725176a2c591931e,FC Sheriff Tiraspol vs. MH Maccabi Tel Aviv: O/U 2.5,Over,Direccional,1,325.5103,0.3899,0.395,28,0.55,9.923047200835034,Wallet 0x076d...8d4c,9.923047200835034,325.5103,1,1.0,0.0,0.0,45.0,100.0,
0x513bf1706e9cbf61b7cc56f12803b1b72a522bae3c5157e7b356abdf36e2e72d,Will Count Binface win the Clacton by-election?,No,Direccional,1,325.4843,0.9613,0.963,15,0.75,13.530887581751614,Wallet 0x006c...16ea,13.530887581751614,325.4843,1,1.0,0.0,0.0,45.0,100.0,Revisar reglas: un pick NO puede incluir empate o una resolución distinta a clasificación.
0xb17eedde7f6535764e16cea706a8d9005baf55a31c73cc681011b83e831a9d97,Bloomfield Hills: Mark Lajal vs Pablo Llamas Ruiz,Mark Lajal,Direccional,1,325.0686,0.5406,0.545,28,0.55,9.916312394232042,Wallet 0x076d...8d4c,9.916312394232042,325.0686,1,1.0,0.0,0.0,45.0,100.0,
0x84f698ac4e21f27dfa51803083f5c115933c13611259e2968e4b2ba06f854912,KBO: NC Dinos vs. Kia Tigers,Kia Tigers,Direccional,1,317.8,0.4841,0.7945,1,1.0,17.826945896591486,swisstony,17.826945896591486,317.8,1,1.0,0.0,0.0,45.0,100.0,
0xa6d4b706470646f75d7d46ea418b79b8adb2029ac5edd941df0f9eb4d79c149a,Wuhan San Zhen FC vs. Henan FC: O/U 4.5,Under,Direccional,1,317.741,0.8399,0.75,1,1.0,17.825291021467223,swisstony,17.825291021467223,317.741,1,1.0,0.0,0.0,45.0,100.0,
0x2c0791f8cc838ac452434465666b3c9c51f12f9bbf4fed2394d1ee0f39869dbd,Will Djurgardens IF win on 2026-07-25?,Yes,Direccional,1,315.6562,0.56,0.555,28,0.55,9.771693839862158,Wallet 0x076d...8d4c,9.771693839862158,315.6562,1,1.0,0.0,0.0,45.0,100.0,
0x1c8870fed75e00b9d759b45992a41a25c6ee55864047d9ee2b3dd5dc72585dc0,Chicago Fire FC vs. Vancouver Whitecaps FC: Both Teams to Score,No,Direccional,1,314.15,0.32,0.305,1,1.0,17.72427713617681,swisstony,34.15499836197819,584.1186,2,0.5189365535413908,16.430721225801378,269.96860000000004,45.0,51.9,Revisar reglas: un pick NO puede incluir empate o una resolución distinta a clasificación.
0xb8be92847800314e6a9e8b6394443d3708afac72da8cdebe970f8c189fb918f7,ITF Horb: Lea Nilsson vs Fiona Ganz,Lea Nilsson,Direccional,1,307.2077,0.8304,0.805,28,0.55,9.640037824095922,Wallet 0x076d...8d4c,9.640037824095922,307.2077,1,1.0,0.0,0.0,45.0,100.0,
0x8d120e90f466ba942be52570068dcb794765e0d8e05070a0754497c239f17f59,Bucheon FC 1995 vs. FC Anyang: O/U 0.5,Over,Direccional,1,298.7706,0.8899,0.9995,1,1.0,17.28498192073107,swisstony,17.28498192073107,298.7706,1,1.0,0.0,0.0,45.0,100.0,
0xd09586ee6d7c486dfbbecdb087327e8b0df1389331a27ce3f0b7f71cf85929ff,Will CF Montréal win on 2026-07-22?,Yes,Direccional,1,296.5371,0.1399,0.135,1,1.0,17.220252611387558,swisstony,17.220252611387558,296.5371,1,1.0,0.0,0.0,45.0,100.0,
0x9ba67df80d30089545d01dc7b5d393c44d9a8569a39e6e1b57a6164d22bdeb32,KBO: LG Twins vs. NC Dinos,LG Twins,Direccional,1,295.9249,0.5,0.505,30,0.55,9.461357315417276,ndb1,9.461357315417276,295.9249,1,1.0,0.0,0.0,45.0,100.0,
0xf89a21f6ead6fde33cabffb979db66466cc67b5c21309b0698db26f1f91ef193,Will Chicago Fire FC win on 2026-07-22?,No,Direccional,1,293.7411,0.6886,0.675,1,1.0,17.138876859351083,swisstony,17.138876859351083,293.7411,1,1.0,0.0,0.0,45.0,100.0,Revisar reglas: un pick NO puede incluir empate o una resolución distinta a clasificación.
0xab4b075154272288ff9b05fda69992f921fc1d2f4c1c9d2d680ca48cd6d7cb88,Will Maitland FC win on 2026-07-22?,No,Direccional,1,290.883,0.5601,0.9995,28,0.55,9.38041083855073,Wallet 0x076d...8d4c,9.38041083855073,290.883,1,1.0,0.0,0.0,45.0,100.0,Revisar reglas: un pick NO puede incluir empate o una resolución distinta a clasificación.
0xde554398c8b2f4b06dbee0a6850930de28efe842e01b6ca3a582248aab6d0059,Will Sydney United 58 FC win on 2026-07-22?,No,Direccional,1,290.6212,0.7096,0.9995,1,1.0,17.047615669060587,swisstony,17.047615669060587,290.6212,1,1.0,0.0,0.0,45.0,100.0,Revisar reglas: un pick NO puede incluir empate o una resolución distinta a clasificación.
0x3a3d95fb55fc68c8d2cbd5261f69b70c822a4318b5bf11efcb3b77440d4e2a90,Spread: FC Seoul (-2.5),Pohang Steelers FC,Direccional,1,288.1772,0.8904,0.595,1,1.0,16.975782750730524,swisstony,16.975782750730524,288.1772,1,1.0,0.0,0.0,45.0,100.0,
0x984c7d9f9040809fbaf7fbf153daefeef26d67cd1391963bdcc786f5f05e416f,ITF Metzingen: Vincent Dullinger vs Alec Beckley,Vincent Dullinger,Direccional,1,287.8109,0.4242,0.46,3,1.0,16.964990421453233,RN1,33.50862363789031,561.5027,2,0.5062872950194782,16.543633216437076,273.6918,45.0,50.6,
0xfd2052594f25def40a18550640ee55714e2b45e1302e1ed59a8b96427742992d,Atlanta Braves vs. Chicago White Sox: O/U 8.5,Over,Direccional,1,287.1301,0.47,0.685,3,1.0,16.944913691134577,RN1,16.944913691134577,287.1301,1,1.0,0.0,0.0,45.0,100.0,
0x164d9a78208197db1c558b999bdd904e63bb97c74399278251fbf84e74adbae3,Tampa Bay Rays vs. New York Yankees: O/U 7.5,Over,Direccional,1,285.1572,0.4192,0.54,30,0.55,9.287629030059286,ndb1,9.287629030059286,285.1572,1,1.0,0.0,0.0,45.0,100.0,
0x87488a6872612e1e2518d5190994f49618b78777acee371038ee8fa11d41df00,Will Orlando City SC win on 2026-07-22?,No,Direccional,1,284.7253,0.8209,0.8149,1,1.0,16.87380514288345,swisstony,16.87380514288345,284.7253,1,1.0,0.0,0.0,45.0,100.0,Revisar reglas: un pick NO puede incluir empate o una resolución distinta a clasificación.
0xc53b6056373f3659365afa094b4ba9af14f540b576a8ca0347309be8b4ed3228,Boston Red Sox vs. New York Yankees: O/U 7.5,Under,Direccional,1,280.8467,0.4416,0.5315,3,1.0,16.758481434784,RN1,16.758481434784,280.8467,1,1.0,0.0,0.0,45.0,100.0,
0x984c7d9f9040809fbaf7fbf153daefeef26d67cd1391963bdcc786f5f05e416f,ITF Metzingen: Vincent Dullinger vs Alec Beckley,Alec Beckley,Direccional,1,273.6918,0.6086,0.54,3,1.0,16.543633216437073,RN1,33.50862363789031,561.5027,2,0.49371270498052167,16.964990421453237,287.8109,45.0,49.4,
0x55f83890e325bb4c7345346f6a259ce65aebd925a9a1042bde732e48507e162e,Will Atlanta United FC win on 2026-07-22?,Yes,Direccional,1,273.4601,0.2457,0.265,1,1.0,16.536629039801312,swisstony,29.078160046819555,430.7501,2,0.5686958532856008,12.541531007018243,157.28999999999996,45.0,56.9,
0x1c8870fed75e00b9d759b45992a41a25c6ee55864047d9ee2b3dd5dc72585dc0,Chicago Fire FC vs. Vancouver Whitecaps FC: Both Teams to Score,Yes,Direccional,1,269.9686,0.68,0.6949,1,1.0,16.430721225801378,swisstony,34.15499836197819,584.1186,2,0.48106344645860916,17.72427713617681,314.15000000000003,45.0,48.1,
0xb6d4ac30ec0f7d004dc320abeca3b5b160dd809c3ed534487f0a555340a8dd18,Spread: Associação Chapecoense de Futebol (-1.5),CR Flamengo,Direccional,1,266.6387,0.9619,0.97,1,1.0,16.329075295312958,swisstony,16.329075295312958,266.6387,1,1.0,0.0,0.0,45.0,100.0,
0x5231d01ce36f146793dac1f6d4e212a349ca0c924ad5e31f999a80c09772ed62,Spread: Independiente Santa Fe (-1.5),Independiente Santa Fe,Direccional,1,262.68,0.42,0.44,28,0.55,8.914073143069896,Wallet 0x076d...8d4c,8.914073143069896,262.68,1,1.0,0.0,0.0,45.0,100.0,
0xff3a3224444463e3722ac41ee245cc7efc3f057ca64a1a77eebb47ddb6d6f5b9,Spread: Chicago Fire FC (-2.5),Chicago Fire FC,Direccional,1,256.5849,0.0699,0.245,1,1.0,16.018267696601903,swisstony,16.018267696601903,256.5849,1,1.0,0.0,0.0,45.0,100.0,
0x7df2322c3c356efc3d7313e50dc0bff380f559084678b34bcd084f888a85a77d,Hanshin Tigers vs. Yokohama BayStars,Hanshin Tigers,Direccional,1,254.038,0.6699,0.79,1,1.0,15.938569571953439,swisstony,15.938569571953439,254.038,1,1.0,0.0,0.0,45.0,100.0,
0x38e640919830ed58dd7e2ac2e45c0ebbde073ffd78bf01086c7301e780659e13,KBO: Hanwha Eagles vs. Kia Tigers,Hanwha Eagles,Direccional,1,253.0161,0.4201,0.955,1,1.0,15.906479811699382,swisstony,15.906479811699382,253.0161,1,1.0,0.0,0.0,45.0,100.0,
0x3052f5ad257b0bcc5551ac6ea6454607379ea77fa53395649d05fb344ebbacb7,ITF Cluj Napoca: Briana Szabo vs Katarina Kujovic,Katarina Kujovic,Direccional,1,249.875,0.3548,0.9995,3,1.0,15.807434959537236,RN1,15.807434959537236,249.875,1,1.0,0.0,0.0,45.0,100.0,
0xbabc896225844371b57a54468c5e2638a47fc64039765fb61c68d10f23885331,Atlanta Braves vs. Chicago White Sox,Atlanta Braves,Direccional,1,247.187,0.4799,0.525,3,1.0,15.722181782437195,RN1,15.722181782437195,247.187,1,1.0,0.0,0.0,45.0,100.0,
0xdceb73fe12304f6de04fbef398b43fc3ca9e5eefa49f1034a8f6da8d0cfdacf2,Bucheon FC 1995 vs. FC Anyang: O/U 1.5,Over,Direccional,1,245.2251,0.6776,0.9995,1,1.0,15.659664747369275,swisstony,15.659664747369275,245.2251,1,1.0,0.0,0.0,45.0,100.0,
0xe6199115aa51bf44b1f6ee1e8b229852ef25328aa69bc5db962cc7f9071e3a1e,FC Cincinnati vs. Vancouver Whitecaps FC: FC Cincinnati O/U 1.5,Over,Direccional,1,244.8249,0.4385,0.43,28,0.55,8.605784813135871,Wallet 0x076d...8d4c,8.605784813135871,244.8249,1,1.0,0.0,0.0,45.0,100.0,
0xcf8669cb5ad120bf2357bd87b5c99f329df3d38b5ec4945e9dd69439f694d13c,ITF Nogent-Sur-Marne: Daphnee Mpetshi Perricard vs Hanna Bougouffa,Daphnee Mpetshi Perricard,Direccional,1,244.1525,0.89,0.905,1,1.0,15.625379995379312,swisstony,15.625379995379312,244.1525,1,1.0,0.0,0.0,45.0,100.0,
0x4d3a23264790c6ae6cab65d7305fc0f597b2f43429cf7f7ef2675b215e400c3d,ITF Nogent-Sur-Marne: Ninon Carpentier vs Sophia Biolay,Sophia Biolay,Direccional,1,243.7499,0.9012,0.9625,3,1.0,15.612491793432591,RN1,15.612491793432591,243.7499,1,1.0,0.0,0.0,45.0,100.0,
0xb43204e841f428ebaec0af5ea83dfe30c4d469526add34c56e6b83ac3df3a982,Will FK Vardar Skopje win on 2026-07-22?,No,Direccional,1,241.0895,0.6699,0.725,28,0.55,8.539881366272017,Wallet 0x076d...8d4c,8.539881366272017,241.0895,1,1.0,0.0,0.0,45.0,100.0,Revisar reglas: un pick NO puede incluir empate o una resolución distinta a clasificación.
0xb4528250bfbecacd1da31cd9dac28d32077c66cc921a8598da6b8e4265144507,Detroit Tigers vs. Cleveland Guardians,Detroit Tigers,Direccional,1,238.7426,0.476,0.535,1,1.0,15.4512976801303,swisstony,15.4512976801303,238.7426,1,1.0,0.0,0.0,45.0,100.0,
0xb695896fca64f385e5d200ba76146ff5886159fa5267e88a7061f18550933d07,FC Seoul vs. Pohang Steelers FC: Pohang Steelers FC O/U 1.5,Over,Direccional,1,238.6836,0.2099,0.5649,1,1.0,15.44938833740676,swisstony,15.44938833740676,238.6836,1,1.0,0.0,0.0,45.0,100.0,
0x24d97408c3454a93f1a783e7cbc8061e95ce2ab613f5bb5cf4a3f9cafe1202a5,FC Seoul vs. Pohang Steelers FC: O/U 1.5,Over,Direccional,1,238.2674,0.6903,0.9995,1,1.0,15.435912671429572,swisstony,15.435912671429572,238.2674,1,1.0,0.0,0.0,45.0,100.0,
0x9d7d307368d0adb1bd350a139c120af2f0a1f59e7e46920b01ee25ec09b03a22,Will Grêmio FBPA win on 2026-07-23?,No,Direccional,1,235.9398,0.8096,0.825,28,0.55,8.44818261521376,Wallet 0x076d...8d4c,8.44818261521376,235.9398,1,1.0,0.0,0.0,45.0,100.0,Revisar reglas: un pick NO puede incluir empate o una resolución distinta a clasificación.
0x6a4a2c60f2302348d10044f94ad43b3f8bc944f70d1391a603889259dbcddb5d,CF Montréal vs. Inter Miami CF: O/U 3.5,Under,Direccional,1,233.6816,0.5498,0.545,28,0.55,8.407656272707634,Wallet 0x076d...8d4c,8.407656272707634,233.6816,1,1.0,0.0,0.0,45.0,100.0,
0x2f4e35f5779045bb3edab874ebcbe28974ffb8ec6338462c59f3afaaca93c4e7,Shanghai Haigang FC vs. Dalian Yingbo FC: O/U 2.5,Over,Direccional,1,230.0848,0.6056,0.385,1,1.0,15.168546403660438,swisstony,15.168546403660438,230.0848,1,1.0,0.0,0.0,45.0,100.0,
0xa239a361b0c7ba843fa5390458f5d965863cf7d5cc59a629df5892700f10bf00,Gwangju FC vs. Gimcheon Sangmu FC: Gwangju FC 1st Half O/U 0.5,Over,Direccional,1,227.9465,0.3299,0.9995,1,1.0,15.09789720457786,swisstony,15.09789720457786,227.9465,1,1.0,0.0,0.0,45.0,100.0,
0x33c9be886cbaf2f34068e31214a43161d09bcefbc0ddc9da44d101541bf26390,St. Louis Cardinals vs. Cincinnati Reds: O/U 6.5,Over,Direccional,1,226.38,0.7777,0.735,1,1.0,15.045929682143274,swisstony,15.045929682143274,226.38,1,1.0,0.0,0.0,45.0,100.0,
0x9ec193ff9cc773755bb8a4e912fa29960c89d2931f6da86c197b2de92f0377f4,Boston Red Sox vs. New York Yankees: O/U 11.5,Under,Direccional,1,224.19,0.77,0.705,1,1.0,14.972975656161337,swisstony,14.972975656161337,224.19,1,1.0,0.0,0.0,45.0,100.0,
0x0041afcd73568dc4712defd37ae7c4b111abde9b87705cfc5e21dc2920fff8f5,Inter Miami CF vs. Chicago Fire FC: O/U 3.5,Over,Direccional,1,219.675,0.5011,0.505,1,1.0,14.821437177278053,swisstony,14.821437177278053,219.675,1,1.0,0.0,0.0,45.0,100.0,
0x6fc95f0ae8dbcbf691a68824a634b2cae70710a1e5cbe5714ad9938a7962447d,Cary: Yosuke Watanuki vs Braden Shick,Braden Shick,Direccional,1,219.3939,0.34,0.5,3,1.0,14.811951255658386,RN1,14.811951255658386,219.3939,1,1.0,0.0,0.0,45.0,100.0,
0xd9fe4c5bce8217e33d4e0bfc43d94453192b79c85369c361a453c45a279506de,Spread: Inter Miami CF (-1.5),Chicago Fire FC,Direccional,1,217.315,0.7299,0.75,1,1.0,14.741607782056882,swisstony,14.741607782056882,217.315,1,1.0,0.0,0.0,45.0,100.0,
0x7818d9d6b2c434969839f6fd3b8808d673c84d9efedd2b09b2e4d1c3fea3973e,Will Nashville SC win on 2026-07-22?,Yes,Direccional,1,215.6058,0.6499,0.655,1,1.0,14.683521376018764,swisstony,14.683521376018764,215.6058,1,1.0,0.0,0.0,45.0,100.0,
0xf6638b8162abc0a42875c54c43776eec738d1799889dd30be4a52f6fd29cf1aa,KBO: Samsung Lions vs. Kia Tigers,Samsung Lions,Direccional,1,213.1391,0.5006,0.515,30,0.55,8.029606325966425,ndb1,8.029606325966425,213.1391,1,1.0,0.0,0.0,45.0,100.0,
0x016602d116e9f23e24a554835130f29e68cc7f82a3013f3c50a2ce862a2bdfd6,Will Chicago Fire FC win on 2026-07-16?,No,Direccional,1,211.365,0.6447,0.495,1,1.0,14.538397435756115,swisstony,26.166045521246147,346.5672,2,0.555620734663605,11.627648085490032,135.2022,45.0,55.6,Revisar reglas: un pick NO puede incluir empate o una resolución distinta a clasificación.
0x9899311bf68ff4a5be435fa29cb9556264fd5e0cb27a60f8ce048b25c692c643,Gwangju FC vs. Gimcheon Sangmu FC: Draw at halftime?,Yes,Direccional,1,210.8945,0.4486,0.9995,1,1.0,14.522207132526377,swisstony,14.522207132526377,210.8945,1,1.0,0.0,0.0,45.0,100.0,
0xd3036c70310e3a7b224e5f225922a7cac80c7849e2e32a359a6e95b4715cadce,ITF Ollersbach: Jan Hrazdil vs Tomas Lanik,Tomas Lanik,Direccional,1,210.3704,0.8913,0.945,3,1.0,14.504151129935181,RN1,14.504151129935181,210.3704,1,1.0,0.0,0.0,45.0,100.0,
0x5d86a5119a0e402fff303244372d5fa94005cce1b286bf38f3300e19fc5d4f43,Game Handicap: NRG (-1.5) vs CCG Esports (+1.5),CCG Esports,Direccional,1,206.7029,0.5409,0.54,28,0.55,7.9074412580808975,Wallet 0x076d...8d4c,7.9074412580808975,206.7029,1,1.0,0.0,0.0,45.0,100.0,
0x5cbe3291e7b9b4582c17f1b4d4a87cf0aa3c72aab1fcc2fb11f0add4c1c4fa9a,Club Bolívar vs. Grêmio FBPA: O/U 2.5,Under,Direccional,1,203.5199,0.47,0.48,28,0.55,7.846322052401368,Wallet 0x076d...8d4c,7.846322052401368,203.5199,1,1.0,0.0,0.0,45.0,100.0,
0x630197beb32b4c70be024fdeeb4136c626664bd6bf0fcc01281668180ab453a9,Fukuoka SoftBank Hawks vs. Orix Buffaloes,Fukuoka SoftBank Hawks,Direccional,1,201.2355,0.6297,0.989,1,1.0,14.185749892057169,swisstony,14.185749892057169,201.2355,1,1.0,0.0,0.0,45.0,100.0,
0xf5832d72b7ff01d3224b0648f8b8f3d063a893275cafab5bae2f991a7b451228,Shanghai Shenhua FC vs. Beijing Guoan FC: O/U 4.5,Under,Direccional,1,200.1083,0.7099,0.7,1,1.0,14.145964088742769,swisstony,14.145964088742769,200.1083,1,1.0,0.0,0.0,45.0,100.0,
0x5c10a63b1d6489baef1d591f6b0b89b4a2385f84feadca4d186928b6e01c6840,LoL: LGD Gaming vs EDward Gaming - Game 2 Winner,LGD Gaming,Direccional,1,198.6951,0.304,0.9995,28,0.55,7.752758718675567,Wallet 0x076d...8d4c,7.752758718675567,198.6951,1,1.0,0.0,0.0,45.0,100.0,
0xe226659531f34c2d3b19f82818908c8e8104e296c7044c3d78f6f0497416444a,Sydney United 58 FC vs. Central Coast Mariners FC: O/U 1.5,Over,Direccional,1,197.6742,0.3799,0.9995,1,1.0,14.059665714376,swisstony,14.059665714376,197.6742,1,1.0,0.0,0.0,45.0,100.0,
0x3ddc2daeb80dab227a33591ec869812391af43d4f20a7986cf194e0eb9ee5ccf,SC Internacional vs. Cruzeiro EC: O/U 4.5,Under,Direccional,1,192.7211,0.8899,0.885,1,1.0,13.882402529821702,swisstony,13.882402529821702,192.7211,1,1.0,0.0,0.0,45.0,100.0,
0xb439b0713caddfd8d76608553b90f1337f8bde77dfa8aac554c8f9a96a6e5d6c,Will Ferencvárosi TC win on 2026-07-23?,No,Direccional,1,192.1143,0.82,0.825,28,0.55,7.623291661087093,Wallet 0x076d...8d4c,7.623291661087093,192.1143,1,1.0,0.0,0.0,45.0,100.0,Revisar reglas: un pick NO puede incluir empate o una resolución distinta a clasificación.
0x3c76ea2c99671e6574bab2ab04328cdb2bcf1ff70fde450e711ed0bb45bf5dd7,Will Chicago Fire FC vs. Vancouver Whitecaps FC end in a draw?,No,Direccional,1,191.5199,0.75,0.84,1,1.0,13.839071500646277,swisstony,13.839071500646277,191.5199,1,1.0,0.0,0.0,45.0,100.0,Revisar reglas: un pick NO puede incluir empate o una resolución distinta a clasificación.
0x94b651b18a1a1052b2a03b5b7aac0d1e9f296aeae65bc8c4082500099404c20d,Club Bolívar vs. Grêmio FBPA: Grêmio FBPA O/U 0.5,Under,Direccional,1,190.575,0.3967,0.385,28,0.55,7.592689740796736,Wallet 0x076d...8d4c,7.592689740796736,190.575,1,1.0,0.0,0.0,45.0,100.0,
0xa0763bdc5cb25254ab03fc243461daad33d294c943e2a489fd653f41dbce8722,Saitama Seibu Lions vs. Nippon Ham Fighters,Nippon Ham Fighters,Direccional,1,184.5904,0.4685,0.425,1,1.0,13.586404969674648,swisstony,13.586404969674648,184.5904,1,1.0,0.0,0.0,45.0,100.0,
0x13013212ba123b175eecd8ebd6fd04bafed56454a965b510885d6d851bb2e3f9,LoL: NRG Esports vs CCG Esports (BO3) - North American Challengers League Group Stage,CCG Esports,Direccional,1,183.3701,0.2699,0.265,28,0.55,7.4477819013448565,Wallet 0x076d...8d4c,7.4477819013448565,183.3701,1,1.0,0.0,0.0,45.0,100.0,
0xa99bbfe20427fabfaf526099c20c51b0979fa4bd0ea9be2a3a440fcb8a1dd04e,Estoril Open: Luca Van Assche vs Pablo Carreno Busta,Pablo Carreno Busta,Direccional,1,180.4709,0.6483,0.645,28,0.55,7.388670194967427,Wallet 0x076d...8d4c,7.388670194967427,180.4709,1,1.0,0.0,0.0,45.0,100.0,
0x45d3489a217adef83d736ec379deb45768058224c8fe997ce10084f04a2af08b,ITF Gentofte: Marie Vogt vs Ann Akasha Ceuca,Marie Vogt,Direccional,1,180.333,0.9021,0.94,1,1.0,13.42881230786997,swisstony,13.42881230786997,180.333,1,1.0,0.0,0.0,45.0,100.0,
0x9cad142db68702d0f2d92c6a1e738d5a22bead8c2b90de5d2329db4b95c90ff6,Will FK Dynama-Minsk win on 2026-07-22?,Yes,Direccional,1,178.875,0.19,0.225,3,1.0,13.374415875095256,RN1,13.374415875095256,178.875,1,1.0,0.0,0.0,45.0,100.0,
0x4d3b8b0cfad46fc18b359cbe2dab58cee42696cda7ada693ef91085529440d5f,Will Real Salt Lake win on 2026-07-22?,No,Direccional,1,176.4539,0.7983,0.795,1,1.0,13.2835951458933,swisstony,13.2835951458933,176.4539,1,1.0,0.0,0.0,45.0,100.0,Revisar reglas: un pick NO puede incluir empate o una resolución distinta a clasificación.
0xf95809b326dcf1ae5b03d6c1cd84d16900cb6394f8a7fff40a88b110a19ab9ae,Segovia: Florent Bax vs Paul Inchauspe,Paul Inchauspe,Direccional,1,172.6694,0.5699,0.595,1,1.0,13.140372901862412,swisstony,13.140372901862412,172.6694,1,1.0,0.0,0.0,45.0,100.0,
0x59bdca317a1209f5ae20a5eb1cc9b8fb02da9d8d9bec5ea0f16cb2af53a567f7,Gwangju FC vs. Gimcheon Sangmu FC: O/U 4.5,Over,Direccional,1,171.3929,0.1,0.15,1,1.0,13.091711118108282,swisstony,13.091711118108282,171.3929,1,1.0,0.0,0.0,45.0,100.0,
0xefbdaf213a482fcf7d32f78a4a0965f8e41ab8bf2211a3d0a2d72ee33b894aaf,Will Jacob Misiorowski win the 2026 NL Cy Young Award?,Yes,Direccional,1,170.8623,0.1923,0.612,30,0.55,7.189286873536207,ndb1,7.189286873536207,170.8623,1,1.0,0.0,0.0,45.0,100.0,
0xd223ca20e627cf9097e40cf8839403a82a924a3b29ff946afe196858123e2c0e,KBO: Hanwha Eagles vs. NC Dinos,NC Dinos,Direccional,1,169.0639,0.4534,0.585,1,1.0,13.002457460034238,swisstony,13.002457460034238,169.0639,1,1.0,0.0,0.0,45.0,100.0,
0xab5da64af67605ab0e4b64bc3cc8b2fa56ea0cd1056feecdc05b3b2bcf6ccddc,Bucheon FC 1995 vs. FC Anyang: 1st Half O/U 0.5,Over,Direccional,1,168.941,0.6347,0.9995,1,1.0,12.997730571142025,swisstony,12.997730571142025,168.941,1,1.0,0.0,0.0,45.0,100.0,
0xb48ea6ced7738277b8565e52a1d57244d4ceb84c5a992206a71c40c2cfe6adeb,Spread: Bucheon FC 1995 (-1.5),FC Anyang,Direccional,1,168.4695,0.8606,0.9905,1,1.0,12.979580116475264,swisstony,12.979580116475264,168.4695,1,1.0,0.0,0.0,45.0,100.0,
