Condition_ID,Mercado,Lado,Tipo,Traders_Coincidentes,Capital_Visible_USD,Precio_Entrada_Promedio,Precio_Actual_Promedio,Ranking_Mejor,Calidad_Ranking,Peso_Lado,Traders,Peso_Total_Mercado,Capital_Total_Mercado,Traders_Totales_Mercado,Consenso_Neto,Oposicion_Peso,Oposicion_Capital_USD,WCI,Consenso_Porcentaje,Advertencia
0x305d7c3d8e2961e20ccd787118c5934bef98bc2ad9e3b55a0ab8a573371bd6eb,Generali Open: Sebastian Baez vs Arthur Rinderknech,Sebastian Baez,Direccional,4,118929.6935,0.54715,0.9995,1,0.825,522.6443367423283,"RN1, Wallet 0x076d...8d4c, Wallet 0x2c33...0563, swisstony",522.6443367423283,118929.6935,4,1.0,0.0,0.0,76.0,100.0,
0x4580509bd2130de97dc14a002359a70c9ff04d7dc6e637d28d58d1a1d3488ca3,Hamburg European Open: Katarzyna Kawa vs Paula Badosa,Paula Badosa,Direccional,3,45088.214799999994,0.5845,0.645,1,0.7666666666666666,214.45107662199442,"Wallet 0x076d...8d4c, Wallet 0x2c33...0563, swisstony",214.45107662199442,45088.214799999994,3,1.0,0.0,0.0,69.9,100.0,
0xf1c6f9ff9bd3b734e9311a87926e098532bb736d46dfbe276731ad3592c3dc4a,ITF Horb: Neus Torner Sensano vs Maria Toma,Neus Torner Sensano,Direccional,3,8672.393100000001,0.5857333333333333,0.9994999999999999,1,0.85,117.23839319228755,"RN1, Wallet 0x076d...8d4c, swisstony",117.23839319228755,8672.393100000001,3,1.0,0.0,0.0,69.5,100.0,
0x179ad066e679114cad7149ff50a8e928071b5748dfb7698dae0612d64ed474b5,Generali Open: Jan-Lennard Struff vs Mariano Navone,Mariano Navone,Direccional,3,9208.2749,0.8327666666666667,0.9994999999999999,1,0.7999999999999999,118.7902251395314,"RN1, jtwyslljy, swisstony",118.7902251395314,9208.2749,3,1.0,0.0,0.0,68.6,100.0,
0xf330a9c9053053882f094c3cd3dd63984f7a6a32ca94a933eb0094fce730b788,Livesport Prague Open: Marie Bouzkova vs Carol Young Suh Lee,Marie Bouzkova,Direccional,3,4906.1754,0.8139666666666666,0.945,1,0.85,103.38417423498933,"RN1, Wallet 0x076d...8d4c, swisstony",120.9414861021289,5214.4346000000005,4,0.85482804591707,17.557311867139575,308.2592000000004,64.4,85.5,
0x0f5a9a8670cc76629faedf09ed8f64e08b1dad8727b834b31515b01322576b6a,Will FC Seoul win on 2026-07-22?,Yes,Direccional,2,287138.5357,0.5373,0.79,1,0.775,390.76867508435123,"Wallet 0x076d...8d4c, swisstony",390.76867508435123,287138.5357,2,1.0,0.0,0.0,64.0,100.0,
0xf8502b19a602d80ac7694be67144bb1f30626fbabd6332251125874a7454edf7,Generali Open: Marco Trungelliti vs Yannick Hanfmann,Yannick Hanfmann,Direccional,2,22362.560999999998,0.77685,0.965,1,1.0,191.6711207744055,"RN1, swisstony",201.71661727781438,22993.261,3,0.9501999555665078,10.045496503408884,630.7000000000007,64.0,95.0,
0x0bbc63372aaf0867db23fc361b4e37f7d3125c7acef6cc8e2d5ce40f65b7e523,Boston Red Sox vs. New York Yankees,New York Yankees,Direccional,2,15232.4334,0.49495,0.495,3,0.875,126.74687823386088,"RN1, Wallet 0x2c33...0563",126.74687823386088,15232.4334,2,1.0,0.0,0.0,64.0,100.0,
0x227ceda7a51e68b609dcfbd7475c5a64a9bd5e30c4316e23abe65ae99b170ee9,Lillestrøm SK vs. Viking FK: Both Teams to Score,No,Direccional,2,290.5397,0.3419,0.3449,1,1.0,23.950502812239414,"RN1, swisstony",23.950502812239414,290.5397,2,1.0,0.0,0.0,64.0,100.0,Revisar reglas: un pick NO puede incluir empate o una resolución distinta a clasificación.
0xa6f18041a9e4db4936e9da82108169296ade7b2d7c9f0bcf2aec7402db9bfd3b,Baltimore Orioles vs. Boston Red Sox,Boston Red Sox,Direccional,2,756.6574,0.55045,0.555,3,0.875,33.80806274026786,"RN1, Wallet 0x2c33...0563",33.80806274026786,756.6574,2,1.0,0.0,0.0,63.2,100.0,
0x19eee811aaeec802a0b1c4f4f20605cb3729c218eb65e6eba6cdd1100bf4362a,Spread: Pohang Steelers FC (-1.5),FC Seoul,Direccional,2,3003.1084,0.94295,0.955,1,0.775,61.776470002166306,"Wallet 0x076d...8d4c, swisstony",61.776470002166306,3003.1084,2,1.0,0.0,0.0,62.9,100.0,
0x2c10caa579f60f43e2248157c2c094453096cb1eec4b60e6a54cd1000b51ff03,Generali Open: Alexander Bublik vs Facundo Acosta,Alexander Bublik,Direccional,2,8508.1607,0.6419,0.655,1,0.7,89.72019072609582,"jtwyslljy, swisstony",89.72019072609582,8508.1607,2,1.0,0.0,0.0,62.7,100.0,
0xeaa7e7c6011f5b8196ef0a0180c9f388d37bf5c35f043ed1a2b6a264ffc992d4,Spread: SE Palmeiras (-1.5),Coritiba FBC,Direccional,2,1915.105,0.75135,0.755,1,0.775,43.19669551224981,"Wallet 0x076d...8d4c, swisstony",43.19669551224981,1915.105,2,1.0,0.0,0.0,62.4,100.0,
0xc79334f3c99fba6006327d86850730be413dcb272e41206991597aba8492cb69,Estoril Open: Nuno Borges vs Roman Andres Burruchaga,Nuno Borges,Direccional,2,4233.3,0.6899,0.685,1,0.7,51.840017120400596,"jtwyslljy, swisstony",51.840017120400596,4233.3,2,1.0,0.0,0.0,61.9,100.0,
0xfc81f849ae77be28286d8689a4b25e901fa7e18a874d996d03f72a7cdcdd624a,Will Shanghai Shenhua FC vs. Beijing Guoan FC end in a draw?,No,Direccional,2,695.3881,0.76495,0.825,1,0.775,26.640912109705837,"Wallet 0x076d...8d4c, swisstony",26.640912109705837,695.3881,2,1.0,0.0,0.0,61.1,100.0,Revisar reglas: un pick NO puede incluir empate o una resolución distinta a clasificación.
0x2f39c668afc7b19d558be8de8e28006b0c53b5ccb0543fe3226c115eaea6a693,Hamburg European Open: Simona Waltert vs Mayar Sherif,Simona Waltert,Direccional,3,83468.9019,0.5383,0.55,1,0.9166666666666666,420.1876358284854,"RN1, Wallet 0x2c33...0563, swisstony",731.8092047940546,120929.3678,7,0.5741764835367633,311.6215689655692,37460.46590000001,60.9,57.4,
0x6fefc0438c7598b23531457c8c60541990d0786bd4bd9dfc3eabc8d95c291092,"Will Bitcoin reach $250,000 by December 31, 2026?",No,Direccional,2,73684.7681,0.95875,0.9855,30,0.47500000000000003,159.01239512834536,"geniusMC, ndb1",159.01239512834536,73684.7681,2,1.0,0.0,0.0,60.9,100.0,Revisar reglas: un pick NO puede incluir empate o una resolución distinta a clasificación.
0xe5e52cb3de3dd95f7217d557d2ec720343a6a63bf135f75eacc19713e09193a3,Counter-Strike: EYEBALLERS vs FaZe (BO3) - BLAST Bounty Qualifier,FaZe,Direccional,2,4135.0468,0.8371,0.9895,13,0.65,57.08389443756984,"Wallet 0x076d...8d4c, Wallet 0x2c33...0563",57.08389443756984,4135.0468,2,1.0,0.0,0.0,60.8,100.0,
0x70a8a51ea6d7eba6d0350a062f1a6451d38fccc137bc1e8f7eb77cffd5ba8e4b,Will Seattle Sounders FC win on 2026-07-22?,No,Direccional,2,521.4058,0.54285,0.555,1,0.775,24.991756050824698,"Wallet 0x076d...8d4c, swisstony",24.991756050824698,521.4058,2,1.0,0.0,0.0,60.8,100.0,Revisar reglas: un pick NO puede incluir empate o una resolución distinta a clasificación.
0xd7cc962775073841fdcc4c37f2c96b9842e36887dbf31f336e401aa7f45f3275,Tampere: Andrej Nedic vs Tom Gentzsch,Andrej Nedic,Direccional,3,2704.9546,0.6233,0.52,1,0.85,65.59287564162496,"RN1, Wallet 0x076d...8d4c, swisstony",87.00905177089696,3163.6072,4,0.7538626649367147,21.416176129272003,458.6525999999999,60.7,75.4,
0x46b4892a93325241f452370e493f9ac202fd232b7f755207ee10e888e37fa911,ITF Vacaria: Luiza Fullana vs Pietra Rivoli,Luiza Fullana,Direccional,2,481.6757,0.83495,0.835,1,0.775,22.141081484368037,"Wallet 0x076d...8d4c, swisstony",22.141081484368037,481.6757,2,1.0,0.0,0.0,60.7,100.0,
0x95dc3e409d4ef7cf1c05208cf174f170f4556964b170a5b01cb92c3eaffb736a,Tampere: Hynek Barton vs Gilles Arnaud Bailly,Hynek Barton,Direccional,2,292.3506,0.63445,0.9,1,0.775,19.246040554797396,"Wallet 0x076d...8d4c, swisstony",19.246040554797396,292.3506,2,1.0,0.0,0.0,60.0,100.0,
0x74ffaf33158f3938948166e0b1887763c6423c51d2ac7d67fc4340b4a7a5ce6b,Counter-Strike: EYEBALLERS vs FaZe - Map 1 Winner,FaZe,Direccional,2,1206.939,0.66995,0.9995,13,0.65,32.306389341656676,"Wallet 0x076d...8d4c, Wallet 0x2c33...0563",32.306389341656676,1206.939,2,1.0,0.0,0.0,59.3,100.0,
0xb8d3be712e630ea2de1410089a5f97428c3c649779a3b6c2d2a1d9f78623f4af,Estoril Open: Hugo Gaston vs Titouan Droguet,Titouan Droguet,Direccional,4,29442.5041,0.309525,0.2849,1,0.7875,209.04108371196077,"RN1, Wallet 0x2c33...0563, jtwyslljy, swisstony",403.90740708297665,54650.5218,7,0.5175470418372804,194.86632337101588,25208.017700000004,59.0,51.8,
0xfa086a518e7f6045b17e542de8fbab13f20b19fbbbcf05c3e26e78540c48b38d,Generali Open: Kilian Feldbausch vs Ignacio Buse,Ignacio Buse,Direccional,2,1675.7142000000001,0.6632,0.632,1,0.775,40.154497811746,"Wallet 0x076d...8d4c, swisstony",47.82098882784978,1870.0120000000002,3,0.8396835531004535,7.666491016103784,194.29780000000005,57.4,84.0,
0x2f39c668afc7b19d558be8de8e28006b0c53b5ccb0543fe3226c115eaea6a693,Hamburg European Open: Simona Waltert vs Mayar Sherif,Mayar Sherif,Direccional,4,37460.4659,0.418375,0.45,1,0.825,311.6215689655692,"RN1, Wallet 0x076d...8d4c, Wallet 0x2c33...0563, swisstony",731.8092047940546,120929.3678,7,0.42582351646323663,420.1876358284854,83468.9019,57.3,42.6,
0x055ae2ce1a9d54d1230b0ec51a3ba2c872544209e3dcc98d38fa2b0453fa278f,Will PFK Levski Sofia win on 2026-07-22?,Yes,Direccional,2,22980.4842,0.43655,0.475,3,0.775,108.60518791153338,"RN1, Wallet 0x076d...8d4c",148.8880188355139,28344.803099999997,3,0.7294420918550637,40.28283092398051,5364.318899999998,57.3,72.9,
0x7b43f4218ae5c5e6b6cc8ea45b18f17c3e9b4d2c3538587332a4603bdd4d4d5f,ITF Ollersbach: Vladyslav Orlov vs Tomohiro Masabayashi,Vladyslav Orlov,Direccional,2,2648.5755,0.7607,0.985,3,0.775,57.87488922427073,"RN1, Wallet 0x076d...8d4c",70.72219244323462,2813.6286999999998,3,0.8183412762652146,12.847303218963887,165.05319999999983,57.3,81.8,
0x660f822831442d4a2ab3b5ce428e45afb5ad0108909096651d07553dfe6cf118,Will Gimcheon Sangmu FC win on 2026-07-22?,Yes,Direccional,2,83678.3168,0.44525000000000003,0.3449,1,0.775,186.0776632834249,"Wallet 0x076d...8d4c, swisstony",277.5323066865895,92042.2686,3,0.6704720812685706,91.4546434031646,8363.951799999995,57.2,67.0,
0xb8d3be712e630ea2de1410089a5f97428c3c649779a3b6c2d2a1d9f78623f4af,Estoril Open: Hugo Gaston vs Titouan Droguet,Hugo Gaston,Direccional,3,25208.0177,0.7515666666666667,0.715,1,0.85,194.86632337101588,"RN1, Wallet 0x076d...8d4c, swisstony",403.90740708297665,54650.5218,7,0.4824529581627196,209.04108371196077,29442.504100000002,55.3,48.2,
0xeae673a62a65f2c121e10f15b4a36155554a989bbca0521fee7f68c76740d412,Counter-Strike: HOTU vs Astralis - Map 2 Winner,Astralis,Direccional,2,7867.424300000001,0.50385,0.65,3,0.875,109.93199242733724,"RN1, Wallet 0x2c33...0563",183.01024226954405,13207.8549,3,0.6006876503962301,73.07824984220682,5340.4306,54.2,60.1,
0xfc20e326d52c24e220a020d6e64a239707b06936e3a5a6c52f559ffab77bba35,Hamburg European Open: Tessa Brockmann vs Elsa Jacquemot,Elsa Jacquemot,Direccional,2,8843.7391,0.69655,0.725,1,1.0,130.02087236864682,"RN1, swisstony",257.75569910929215,18520.5611,4,0.5044345200434001,127.73482674064533,9676.821999999998,53.9,50.4,
0xfc20e326d52c24e220a020d6e64a239707b06936e3a5a6c52f559ffab77bba35,Hamburg European Open: Tessa Brockmann vs Elsa Jacquemot,Tessa Brockmann,Direccional,2,9676.822,0.34309999999999996,0.275,1,1.0,127.73482674064533,"RN1, swisstony",257.75569910929215,18520.5611,4,0.49556547995659994,130.02087236864682,8843.739099999999,53.8,49.6,
0xa5e1eec9ea183ebdea91adfa0303bdacc3d7798e11da798467535b1c1764b74d,ITF Bacau: Stefan Ilie Bogdan Petre vs Stefan Adrian Andreescu,Stefan Adrian Andreescu,Direccional,2,567.3129,0.6344000000000001,0.75,3,0.775,25.523554758574484,"RN1, Wallet 0x076d...8d4c",39.6310173227637,766.3334,3,0.6440297646337225,14.107462564189213,199.02049999999997,50.2,64.4,
0xcabd45bbac7facb7980779e2ac69dc1a910829ca3a946b8341ad11b532d9a512,Generali Open: Alex Molcan vs Daniel Altmaier,Alex Molcan,Direccional,2,609.5332,0.5562,0.5649,1,0.775,28.17400720466466,"Wallet 0x076d...8d4c, swisstony",54.555819121210504,4959.5332,3,0.5164253357110904,26.381811916545843,4350.0,46.5,51.6,
0x6ad4cd62b92a2bb37a61c6c77edcdae3587733db435ab6aebcfd3990bef1daba,Counter-Strike: HOTU vs Astralis (BO3) - StarLadder StarSeries European Qualifier Group B,Astralis,Direccional,2,6588.7595,0.50795,0.425,3,0.775,88.84226461306666,"RN1, Wallet 0x076d...8d4c",215.331827028311,22588.3689,3,0.41258306233284325,126.48956241524435,15999.609400000001,46.3,41.3,
0x4b1205f15acbe056307f5fc5d6022808f0a2a10f67a3f61cbb59edd821cc823a,Will Viking FK win on 2026-05-30?,No,Direccional,2,382.7936,0.55495,0.5575,1,0.775,22.238957256952872,"Wallet 0x076d...8d4c, swisstony",45.188336333520496,909.4676,3,0.49213932313892506,22.949379076567624,526.674,45.1,49.2,Revisar reglas: un pick NO puede incluir empate o una resolución distinta a clasificación.
0x16c63b7cc37f012b9f59ee164ec03877914c701d06d48291ae8d6fc08a088b0d,"2026 Balance of Power: D Senate, D House",No,Direccional,1,4521461.193,0.5,0.5649,13,0.75,1594.7795838492855,Wallet 0x2c33...0563,2994.2364213468736,8003202.4197,2,0.5326164535571037,1399.4568374975881,3481741.2267000005,45.0,53.3,Revisar reglas: un pick NO puede incluir empate o una resolución distinta a clasificación.
0x16c63b7cc37f012b9f59ee164ec03877914c701d06d48291ae8d6fc08a088b0d,"2026 Balance of Power: D Senate, D House",Yes,Direccional,1,3481741.2267,0.5,0.435,13,0.75,1399.456837497588,Wallet 0x2c33...0563,2994.2364213468736,8003202.4197,2,0.46738354644289626,1594.7795838492857,4521461.193,45.0,46.7,
0x86bfb53af7250a40928975c551d12c185b762fa4ce0b40c6a64a50c946d72587,Will the Republican Party control the Senate after the 2026 Midterm elections?,Yes,Direccional,1,1054500.0,0.5,0.555,30,0.55,564.7886772944373,ndb1,1070.5195840027382,1900000.0,2,0.527583694622996,505.73090670830084,845500.0,45.0,52.8,
0x86bfb53af7250a40928975c551d12c185b762fa4ce0b40c6a64a50c946d72587,Will the Republican Party control the Senate after the 2026 Midterm elections?,No,Direccional,1,845500.0,0.5,0.445,30,0.55,505.73090670830084,ndb1,1070.5195840027382,1900000.0,2,0.472416305377004,564.7886772944373,1054500.0,45.0,47.2,Revisar reglas: un pick NO puede incluir empate o una resolución distinta a clasificación.
0x86e8f678e6cebb9596ffbb5a736b2ff9f36b12905d5b65b1556329c28533c7a1,Will Manchester City win the 2026-27 English Premier League (EPL) Championship?,No,Direccional,1,201938.6409,0.7,0.705,30,0.55,247.15670913865563,ndb1,247.15670913865563,201938.6409,1,1.0,0.0,0.0,45.0,100.0,Revisar reglas: un pick NO puede incluir empate o una resolución distinta a clasificación.
0x26f410f7518fa199678ef57f02637fc88be9b3b593346b00946d7ea451f4521b,Will Ousmane Dembélé win the 2026 Ballon d'Or?,No,Direccional,1,86885.9428,0.9568,0.9835,30,0.55,162.12031858160162,ndb1,162.12031858160162,86885.9428,1,1.0,0.0,0.0,45.0,100.0,Revisar reglas: un pick NO puede incluir empate o una resolución distinta a clasificación.
0x18076e7d0f58a52d3d4f311d0456306edf16d1873cf5eef27d3ff044153e9576,"Bitcoin all time high by December 31, 2026?",No,Direccional,1,84844.5825,0.8565,0.942,30,0.55,160.20451368875348,ndb1,160.20451368875348,84844.5825,1,1.0,0.0,0.0,45.0,100.0,Revisar reglas: un pick NO puede incluir empate o una resolución distinta a clasificación.
0x02deb9538f5c123373adaa4ee6217b01745f1662bc902e46ac92f3fe6f8741e8,"Will Bitcoin hit $150k by December 31, 2026?",No,Direccional,1,82336.9287,0.9038,0.9615,30,0.55,157.8192666683951,ndb1,157.8192666683951,82336.9287,1,1.0,0.0,0.0,45.0,100.0,Revisar reglas: un pick NO puede incluir empate o una resolución distinta a clasificación.
0xa4ddc18895cc7b14810283ef8f113939abffd3969c6a0e37f1897110c67e6f73,Hantavirus pandemic in 2026?,No,Direccional,1,80481.9392,0.9119,0.9655,15,0.75,212.77004206419662,Wallet 0x006c...16ea,212.77004206419662,80481.9392,1,1.0,0.0,0.0,45.0,100.0,Revisar reglas: un pick NO puede incluir empate o una resolución distinta a clasificación.
0xc0b7319f73f248310b059c231fb069e64dbd68ca81dd9933728ca192b54c3cc4,Will Trump be in the WC Champions Photo?,Yes,Direccional,1,63364.353,0.8967,0.9985,13,0.75,188.7920775946385,Wallet 0x2c33...0563,188.7920775946385,63364.353,1,1.0,0.0,0.0,45.0,100.0,
0x472c9035786b390c08e674fc60bddda488957e1b8aecad3f5480cc531a0754b0,"Will Bitcoin reach $160,000 by December 31, 2026?",No,Direccional,1,41822.468,0.9449,0.9715,30,0.55,112.47798260104065,ndb1,112.47798260104065,41822.468,1,1.0,0.0,0.0,45.0,100.0,Revisar reglas: un pick NO puede incluir empate o una resolución distinta a clasificación.
0xc300d44a0671df2afe77eed3bd7883d038a6e7c332e362ded77830b64076e729,Counter-Strike: EYEBALLERS vs FaZe - Map 2 Winner,FaZe,Direccional,1,41466.6279,0.999,0.9815,13,0.75,152.7251721025385,Wallet 0x2c33...0563,152.7251721025385,41466.6279,1,1.0,0.0,0.0,45.0,100.0,
0x6123b5cc75c38ba9783f6c8ea260107b546c7d3454a8f9b5280c9921cc39f3d9,"Bitcoin all time high by September 30, 2026?",No,Direccional,1,35439.0909,0.9574,0.9845,30,0.55,103.53900229985801,ndb1,103.53900229985801,35439.0909,1,1.0,0.0,0.0,45.0,100.0,Revisar reglas: un pick NO puede incluir empate o una resolución distinta a clasificación.
0xac32e73aa9e0dae801d88d4f81efd2ef3fa0f04b815f3a0e74426f0762e668cd,"Will Bitcoin reach $200,000 by December 31, 2026?",No,Direccional,1,30212.7839,0.9656,0.9785,30,0.55,95.60003728948018,ndb1,95.60003728948018,30212.7839,1,1.0,0.0,0.0,45.0,100.0,Revisar reglas: un pick NO puede incluir empate o una resolución distinta a clasificación.
0x6edddf212b66dec9ef539be85b4aca0df3b2299776f35682c09e06146a3645bf,Map 2 Rounds Handicap: FaZe (-3.5) vs EYEBALLERS (+3.5),FaZe,Direccional,1,29623.7078,0.5676,0.485,13,0.75,129.08654320842277,Wallet 0x2c33...0563,129.08654320842277,29623.7078,1,1.0,0.0,0.0,45.0,100.0,
0xe71b9d788ce662d967ff2c90749ff8b26cee290455ef6cb84f33d1393ffae115,"Will Bitcoin reach $190,000 by December 31, 2026?",No,Direccional,1,29295.0037,0.9654,0.9765,30,0.55,94.13680799373857,ndb1,94.13680799373857,29295.0037,1,1.0,0.0,0.0,45.0,100.0,Revisar reglas: un pick NO puede incluir empate o una resolución distinta a clasificación.
0x799c35de1e5f3ebd75053643e020e6df9e9a3f477e3d6066eb0a8565f65d547f,"Will Bitcoin reach $180,000 by December 31, 2026?",No,Direccional,1,24650.2231,0.9663,0.9775,30,0.55,86.35214234603565,ndb1,86.35214234603565,24650.2231,1,1.0,0.0,0.0,45.0,100.0,Revisar reglas: un pick NO puede incluir empate o una resolución distinta a clasificación.
0x29d203f90b02392439bb3f919af6bee4589c747ed655e05a89fdfa274404a828,Will Charlotte FC win on 2026-07-22?,No,Direccional,1,21150.0318,0.5181,0.525,28,0.55,79.9867777792055,Wallet 0x076d...8d4c,97.75189809965366,21465.6313,2,0.8182631676129969,17.765120320448162,315.59950000000026,45.0,81.8,Revisar reglas: un pick NO puede incluir empate o una resolución distinta a clasificación.
0x8d8e0630bd63491f2a77d1e0fb0f2750ec4ff118151bade96b00700813d7c467,St. Louis Cardinals vs. Cincinnati Reds,St. Louis Cardinals,Direccional,1,19587.6257,0.4212,0.415,30,0.55,76.97568950162123,ndb1,76.97568950162123,19587.6257,1,1.0,0.0,0.0,45.0,100.0,
0x9affeb38bce1e9a6de30e9ecada1ecfaf636574d3961cf3b9177299786214234,"Will Bitcoin reach $170,000 by December 31, 2026?",No,Direccional,1,19510.5789,0.9519,0.9775,30,0.55,76.82415061196578,ndb1,76.82415061196578,19510.5789,1,1.0,0.0,0.0,45.0,100.0,Revisar reglas: un pick NO puede incluir empate o una resolución distinta a clasificación.
0x2745c38ff0617cb345c1d2df19b4f74ea777508e07411e88eeb6ab3affcda2a2,"Will Bitcoin dip to $35,000 by December 31, 2026?",No,Direccional,1,18096.1356,0.85,0.905,13,0.75,100.89140833093768,Wallet 0x2c33...0563,100.89140833093768,18096.1356,1,1.0,0.0,0.0,45.0,100.0,Revisar reglas: un pick NO puede incluir empate o una resolución distinta a clasificación.
0xba9987738b849610b4f2e9aa67a07434c891e3e9254dde20aa87af894de74c86,Bucheon FC 1995 vs. FC Anyang: Both Teams to Score,Yes,Direccional,1,17076.8661,0.5269,0.9995,1,1.0,130.67848369184577,swisstony,130.67848369184577,17076.8661,1,1.0,0.0,0.0,45.0,100.0,
0x6ad4cd62b92a2bb37a61c6c77edcdae3587733db435ab6aebcfd3990bef1daba,Counter-Strike: HOTU vs Astralis (BO3) - StarLadder StarSeries European Qualifier Group B,HOTU,Direccional,1,15999.6094,0.5339,0.575,3,1.0,126.48956241524436,RN1,215.331827028311,22588.3689,3,0.5874169376671569,88.84226461306665,6588.759500000002,45.0,58.7,
0x7e8f8596bceba09095a584e6f2ce3a0df89ae90890ac2013756941531a1e60b5,MLB: Aaron Judge or Juan Soto to draw more walks?,Soto,Direccional,1,13828.5538,0.2719,0.905,30,0.55,64.677179317747,ndb1,64.677179317747,13828.5538,1,1.0,0.0,0.0,45.0,100.0,
0x547c287709181a6836ce6456d8907c7710a44d7d3daaca00b3d7db446c47f6e0,Counter-Strike: HOTU vs Astralis - Map 1 Winner,HOTU,Direccional,1,13546.1802,0.6038,0.9995,3,1.0,116.38805866582706,RN1,116.38805866582706,13546.1802,1,1.0,0.0,0.0,45.0,100.0,
0xe85d65538ebcf8bd8adb2397657946a5a1638e4cc806eef37138ca12058d3a45,Will Tromsø IL win on 2026-07-23?,Yes,Direccional,1,12257.4071,0.5738,0.625,28,0.55,60.89224620384767,Wallet 0x076d...8d4c,69.08414679223374,12479.2492,2,0.8814214118758288,8.19190058838607,221.84209999999985,45.0,88.1,
0x84e5319fc2ff6dcf8c82a3bd46491e99d13a2b6501d53b5a2fc83dde22236106,ITF Kursumlijska Banja: Kolos Kincses vs Nikola Matovic,Kolos Kincses,Direccional,1,12039.6108,0.8881,0.9995,3,1.0,109.72516028696427,RN1,109.72516028696427,12039.6108,1,1.0,0.0,0.0,45.0,100.0,
0x6915eebfc4e59a01872275bae229f78a65316401d356f0473848d4a2d178a38e,Will NK Celje win on 2026-07-22?,Yes,Direccional,1,11967.4093,0.4316,0.495,28,0.55,60.16761016734835,Wallet 0x076d...8d4c,96.89230825324145,16425.9331,2,0.6209740613268494,36.7246980858931,4458.523799999999,45.0,62.1,
0xd3eb5bac621abdcd1a703380558c76c6e162330000f2f733065740b3c554a6df,Will Universitatea Craiova CS win on 2026-07-22?,No,Direccional,1,11032.1805,0.7162,0.765,28,0.55,57.76880301036192,Wallet 0x076d...8d4c,57.76880301036192,11032.1805,1,1.0,0.0,0.0,45.0,100.0,Revisar reglas: un pick NO puede incluir empate o una resolución distinta a clasificación.
0x75abb5b9b5ef0ed3f468be0b91559f2a413b750b4a7a1744151ae229df97eded,St. Louis Cardinals vs. Cincinnati Reds: O/U 9.5,Over,Direccional,1,10402.3959,0.52,0.6,32,0.55,56.095675053875595,LaBradfordSmith22,56.095675053875595,10402.3959,1,1.0,0.0,0.0,45.0,100.0,
0x4bc65b11a89998d2a230e21c453571b547ee46cb341b632c57569d893fc3e624,ITF Kursumlijska Banja: Lorenzo Comino vs Elijah Sanogo,Lorenzo Comino,Direccional,1,10244.8783,0.9099,0.865,3,1.0,101.21698622266916,RN1,101.21698622266916,10244.8783,1,1.0,0.0,0.0,45.0,100.0,
0x9527c12aa0f58d7b53ce3c4d0eebf0ce4f9da4ef4f1d772e025c541eb142ca62,ITF Nogent-Sur-Marne: Anna Hertel vs Kateryna Diatlova,Kateryna Diatlova,Direccional,1,9504.441,0.445,0.775,3,1.0,97.49072263554108,RN1,141.8674913326871,11473.7386,2,0.6871956479932386,44.376768697146034,1969.2975999999999,45.0,68.7,
0x09b9f51bd1767cd5429c18092e8e1d03370831e777eaa8219e6a90febe66172a,Spread: St. Louis Cardinals (-1.5),Cincinnati Reds,Direccional,1,9361.5123,0.5616,0.705,30,0.55,53.21519962144275,ndb1,53.21519962144275,9361.5123,1,1.0,0.0,0.0,45.0,100.0,
0x3d7a975be54b6a10a0ed071f12d4fed157e7e01c11da5f585ece547917f71d38,Will Qarabağ Ağdam FK win on 2026-07-23?,Yes,Direccional,1,9311.4869,0.5212,0.635,28,0.55,53.07282531814187,Wallet 0x076d...8d4c,53.07282531814187,9311.4869,1,1.0,0.0,0.0,45.0,100.0,
0x1406da2900f4e157ceec937e52c4693b1005e473d98ea046012f28daf2ffe15b,Counter-Strike: Aurora Gaming vs K27 - Map 1 Winner,K27,Direccional,1,7129.8698,0.3975,0.9995,3,1.0,84.43855635904725,RN1,84.43855635904725,7129.8698,1,1.0,0.0,0.0,45.0,100.0,
0xfee04bc13ce1c0a8e9fe32e40807caddf82da5a8f096fc94451ad98850b10373,Will Houston Dash win on 2026-07-24?,Yes,Direccional,1,5589.0121,0.3119,0.355,28,0.55,41.11783263074551,Wallet 0x076d...8d4c,41.11783263074551,5589.0121,1,1.0,0.0,0.0,45.0,100.0,
0xeae673a62a65f2c121e10f15b4a36155554a989bbca0521fee7f68c76740d412,Counter-Strike: HOTU vs Astralis - Map 2 Winner,HOTU,Direccional,1,5340.4306,0.4546,0.35,3,1.0,73.07824984220682,RN1,183.01024226954405,13207.8549,3,0.39931234960377,109.93199242733724,7867.424300000001,45.0,39.9,
0xee2be06c3c2e67f22e1e4eb971996dec088d5aa8be76986c37217b8f3c440a03,ITF Gentofte: Sara Cakarevic vs Polina Skliar,Sara Cakarevic,Direccional,1,5004.8867,0.2479,0.807,3,1.0,70.74522386705692,RN1,113.63124839719961,6844.0978,2,0.6225859951812375,42.88602453014269,1839.2110999999995,45.0,62.3,
0x9c91ff4f3a8e2ab69650e8677be80643b2494260d1dedabb1403e06968e9e975,Spread: PFK Levski Sofia (-1.5),PFK Levski Sofia,Direccional,1,4860.0,0.21,0.225,3,1.0,69.7137002317335,RN1,69.7137002317335,4860.0,1,1.0,0.0,0.0,45.0,100.0,
0x407a57edbe2b72c403cfee2c0f43e4b54f1b70a2531c7ad598849c3a70c2ad99,Will Han Feng Win the 2026 WSOP Main Event?,No,Direccional,1,4510.4907,0.9345,0.93,30,0.55,36.93810277680759,ndb1,36.93810277680759,4510.4907,1,1.0,0.0,0.0,45.0,100.0,Revisar reglas: un pick NO puede incluir empate o una resolución distinta a clasificación.
0x02f594b89bcac7313a0440436101e6c090e95615cbfdf07f58bb17a522b9e250,Map Handicap: G2 (-1.5) vs Nemiga (+1.5),Nemiga,Direccional,1,4393.9718,0.4,0.405,13,0.75,49.71528072434069,Wallet 0x2c33...0563,49.71528072434069,4393.9718,1,1.0,0.0,0.0,45.0,100.0,
0x895ca922a6852e7635f7c02bd1568b059fbb72253542d0de400221bb3c3ca20c,Counter-Strike: Aurora Gaming vs K27 (BO3) - StarLadder StarSeries Group A,K27,Direccional,1,4146.3026,0.2816,0.275,3,1.0,64.39178984932784,RN1,121.79667030386759,7441.6229,2,0.5286826781773123,57.40488045453975,3295.3203000000003,45.0,52.9,
0xae0c8a794fe4d0300eca6b39e8bea60ab0f1a2078aa8ca2aac88adc4808a69a6,LoL: Top Esports vs Team WE - Game 1 Winner,Team WE,Direccional,1,4111.1107,0.3545,0.2849,13,0.75,48.08845774975529,Wallet 0x2c33...0563,48.08845774975529,4111.1107,1,1.0,0.0,0.0,45.0,100.0,
0x983aafe2560d2e3987a2ecbeb022c364160c03ead3543d607e0aa2313006d2aa,Spread: St. Louis Cardinals (-1.5),St. Louis Cardinals,Direccional,1,3809.4107,0.3894,0.42,1,1.0,61.72042368616729,swisstony,76.88272891987103,4039.3062,2,0.8027865887863287,15.16230523370374,229.89550000000008,45.0,80.3,
0x9d456843ff5ed939ed9b4c4be65c3b35276850e959e71f85a6d474a74abebb9f,Will Kansas City Current win on 2026-07-25?,Yes,Direccional,1,3631.1526,0.3794,0.485,28,0.55,33.142475186684536,Wallet 0x076d...8d4c,33.142475186684536,3631.1526,1,1.0,0.0,0.0,45.0,100.0,
0x71ea5fbd6504dcb4c91da2a97d75b9becff002831fe27600ab42406fb89758e1,Bucheon FC 1995 vs. FC Anyang: O/U 2.5,Over,Direccional,1,3440.9018,0.4935,0.9995,1,1.0,58.659200471878236,swisstony,58.659200471878236,3440.9018,1,1.0,0.0,0.0,45.0,100.0,
