Condition_ID,Mercado,Lado,Tipo,Traders_Coincidentes,Capital_Visible_USD,Precio_Entrada_Promedio,Precio_Actual_Promedio,Ranking_Mejor,Calidad_Ranking,Peso_Lado,Traders,Peso_Total_Mercado,Capital_Total_Mercado,Traders_Totales_Mercado,Consenso_Neto,Oposicion_Peso,Oposicion_Capital_USD,WCI,Consenso_Porcentaje,Advertencia
0x8240d9450bb180fa511177b4395964ed30f6d6c2b0a51ff53a71e8c834553059,Will New England Revolution win on 2026-07-22?,No,Direccional,1,115.2706,0.5,0.495,1,1.0,10.736414671574492,swisstony,10.736414671574492,115.2706,1,1.0,0.0,0.0,45.0,100.0,Revisar reglas: un pick NO puede incluir empate o una resolución distinta a clasificación.
0x2c08f749de4443542bc911b5081768abd01f0e1364c45019a4531553c8c9d0ee,Estoril Open: Alejandro Tabilo vs Tiago Torres,Tiago Torres,Direccional,1,114.25,0.12,0.125,28,0.55,5.8788285397687865,Wallet 0x076d...8d4c,5.8788285397687865,114.25,1,1.0,0.0,0.0,45.0,100.0,
0xad0500fecfe95df06ce33c31b2a429437836b9518a29ac02a09d101ae4011a78,ITF Segrate: Juan Cruz Martin Manzano vs Tobia Costanzo Baragiola Mordini,Tobia Costanzo Baragiola Mordini,Direccional,1,113.7874,0.3083,0.33,3,1.0,10.667117698797552,RN1,10.667117698797552,113.7874,1,1.0,0.0,0.0,45.0,100.0,
0x72dd1ad8175ead3e78e6869dfe1a9d4d33c1b6d0741d99cb19e8812b4830625b,Spread: Milwaukee Brewers (-1.5),Milwaukee Brewers,Direccional,1,112.568,0.3899,0.385,1,1.0,10.609806784291598,swisstony,10.609806784291598,112.568,1,1.0,0.0,0.0,45.0,100.0,
0x9f83d9208250bf9deb6167684b22766d043cc8728c556b9277f4a6d06466cbc3,Nashville SC vs. CF Montréal: O/U 3.5,Under,Direccional,1,111.8755,0.6222,0.615,1,1.0,10.577121536599643,swisstony,10.577121536599643,111.8755,1,1.0,0.0,0.0,45.0,100.0,
0x1397f56282b5b14ba9937ccf9ca25622b0a840524cd0404f755b92c447632767,LoL: Barça eSports vs UCAM Esports Club (BO3) - LES Regular Season,Barça eSports,Direccional,1,111.7722,0.2699,0.275,28,0.55,5.814730475267104,Wallet 0x076d...8d4c,5.814730475267104,111.7722,1,1.0,0.0,0.0,45.0,100.0,
0xab5da64af67605ab0e4b64bc3cc8b2fa56ea0cd1056feecdc05b3b2bcf6ccddc,Bucheon FC 1995 vs. FC Anyang: 1st Half O/U 0.5,Over,Direccional,1,111.5568,0.6347,0.66,1,1.0,10.562045256483234,swisstony,10.562045256483234,111.5568,1,1.0,0.0,0.0,45.0,100.0,
0xabbf27aba65e916bb7a99e7f29c547a6c67794a9b0a88662ef3b3d0910915789,Philadelphia Union vs. New York Red Bulls: O/U 3.5,Under,Direccional,1,111.5204,0.5699,0.575,1,1.0,10.560321964788763,swisstony,10.560321964788763,111.5204,1,1.0,0.0,0.0,45.0,100.0,
0x99007947be2e254f51d7f0b0dd8ff5ee7a72210be0aef0c072e09c1c77340f90,Bucheon FC 1995 vs. FC Anyang: O/U 3.5,Over,Direccional,1,111.4407,0.2294,0.255,1,1.0,10.556547731147717,swisstony,10.556547731147717,111.4407,1,1.0,0.0,0.0,45.0,100.0,
0x631a8a75cf199c080321ca3ba833c5e4c9aae35071e7a37287ad3044f1d62bfc,Will Tianjin Jinmen Hu FC vs. Liaoning Tieren FC end in a draw?,No,Direccional,1,108.9384,0.7103,0.76,1,1.0,10.437355987030433,swisstony,10.437355987030433,108.9384,1,1.0,0.0,0.0,45.0,100.0,Revisar reglas: un pick NO puede incluir empate o una resolución distinta a clasificación.
0xf4bae0e3fe8c07460a3b7efbc5c1105bcaccaa71428c92af06cf7c63857142e6,Will Henan FC win on 2026-07-11?,No,Direccional,1,108.8637,0.576,0.555,1,1.0,10.433776880880671,swisstony,10.433776880880671,108.8637,1,1.0,0.0,0.0,45.0,100.0,Revisar reglas: un pick NO puede incluir empate o una resolución distinta a clasificación.
0x6ed31bf63662b2f4f06135ec1ca3a442116970025f8aee05f2fd198af2296d18,Los Angeles Galaxy vs. St. Louis City SC: St. Louis City SC O/U 1.5,Over,Direccional,1,107.5401,0.3998,0.385,28,0.55,5.7035848595422864,Wallet 0x076d...8d4c,5.7035848595422864,107.5401,1,1.0,0.0,0.0,45.0,100.0,
0xebf953dcf6fdb6a55d7f9a8f144c77710b84c03588da9a232f71cf7ae597ffd6,Will Inter Miami CF vs. Chicago Fire FC end in a draw?,Yes,Direccional,1,107.1684,0.2299,0.225,28,0.55,5.693719434605116,Wallet 0x076d...8d4c,5.693719434605116,107.1684,1,1.0,0.0,0.0,45.0,100.0,
0x95816a83b5c352b955416bbde283a26ce24c200d9ac829b8188589421a3657b4,Will SK Dinamo Tbilisi vs. FK Žalgiris Vilnius end in a draw?,Yes,Direccional,1,107.0735,0.2901,0.295,28,0.55,5.691197918716235,Wallet 0x076d...8d4c,5.691197918716235,107.0735,1,1.0,0.0,0.0,45.0,100.0,
0xd9aae2ca9e29bd70eab4e126c781915c521b97b6ed675ea12ce8375a4a463e0d,SC Internacional vs. Cruzeiro EC: O/U 2.5,Under,Direccional,1,106.275,0.54,0.545,1,1.0,10.308976670843718,swisstony,10.308976670843718,106.275,1,1.0,0.0,0.0,45.0,100.0,
0xcb6871a68e9fb1dc055a4e389e154f91bcb6f4928f128c9b6b64c545ba075642,Spread: CR Vasco da Gama (-2.5),Independiente Medellín,Direccional,1,106.15,0.96,0.965,3,1.0,10.302912209661887,RN1,10.302912209661887,106.15,1,1.0,0.0,0.0,45.0,100.0,
0x5ed8f115701f54d62aa442bb064241e8a8236193d4bdee7b43ab4e3ec3732bcf,Will FC Cincinnati win on 2026-07-22?,Yes,Direccional,1,105.9654,0.2399,0.235,1,1.0,10.293949679301916,swisstony,10.293949679301916,105.9654,1,1.0,0.0,0.0,45.0,100.0,
0x8898e349c7ded7166fa761fc08c7d3e82c7a217a318526b8641a0231e6674d78,Zug: Max Alcala Gurri vs Dylan Dietrich,Dylan Dietrich,Direccional,1,105.7075,0.553,0.512,28,0.55,5.654778399725316,Wallet 0x076d...8d4c,5.654778399725316,105.7075,1,1.0,0.0,0.0,45.0,100.0,
0x7885c6d938039e7e726a0ba135f3221445005018b6571d9a03569b9609460738,ITF Horb: Gyeong Seo Lee vs Alina Granwehr,Gyeong Seo Lee,Direccional,1,105.3999,0.1553,0.07,3,1.0,10.266445343934775,RN1,10.266445343934775,105.3999,1,1.0,0.0,0.0,45.0,100.0,
0xca1fa4f78efe66209f5215329c405ee814b6ab6f2bfc897641a884a93993a3dc,AS Omónoia Leukosías vs. Qairat FK: O/U 0.5,Under,Direccional,1,104.9002,0.08,0.085,28,0.55,5.633143926796119,Wallet 0x076d...8d4c,5.633143926796119,104.9002,1,1.0,0.0,0.0,45.0,100.0,
0x2897372c1e1aadfcc6c8b781b3a026f1d856605d00fa63d3a35440b508d24401,Connecticut Sun vs. Indiana Fever,Indiana Fever,Direccional,1,104.3394,0.8159,0.8149,28,0.55,5.618066259844219,Wallet 0x076d...8d4c,5.618066259844219,104.3394,1,1.0,0.0,0.0,45.0,100.0,
0x949e839486b97f6765478ecb6f9825a189e70c29628660ad9680a377f0156a16,Spread: Philadelphia Union (-1.5),New York Red Bulls,Direccional,1,104.28,0.65,0.66,1,1.0,10.211757928975794,swisstony,10.211757928975794,104.28,1,1.0,0.0,0.0,45.0,100.0,
0x5c76a448a968f53ac301b42f11a90ed7ebc3d1da99f628ec144263d5cb1116cf,Will FC Sheriff Tiraspol vs. MH Maccabi Tel Aviv end in a draw?,Yes,Direccional,1,102.6494,0.2799,0.295,28,0.55,5.572382210509255,Wallet 0x076d...8d4c,5.572382210509255,102.6494,1,1.0,0.0,0.0,45.0,100.0,
0x79bae2288832301a281f93bef40e3a53b72bf709158e719b3e68fd4577a54bdb,Will FC Baník Ostrava win on 2026-07-25?,Yes,Direccional,1,101.996,0.4,0.43,28,0.55,5.554618798801589,Wallet 0x076d...8d4c,5.554618798801589,101.996,1,1.0,0.0,0.0,45.0,100.0,
0xf1eeb99016f4fdd68b1a61320910a71443c51aaa996a73d8cc182718b751fa25,KBO: Hanwha Eagles vs. Lotte Giants,Hanwha Eagles,Direccional,1,101.6094,0.52,0.5225,30,0.55,5.54408184463397,ndb1,5.54408184463397,101.6094,1,1.0,0.0,0.0,45.0,100.0,
0xdb120e0c5fcc7f8ef84666410719b0a389e37951784dec1d9a93cd8d90dd7703,Will Colorado Rapids SC win on 2026-07-22?,No,Direccional,1,106.09,0.54,0.515,1,1.0,10.3,swisstony,20.416071371832054,208.4249,2,0.5045045059065995,10.116071371832053,102.3349,44.7,50.5,Revisar reglas: un pick NO puede incluir empate o una resolución distinta a clasificación.
0xdb120e0c5fcc7f8ef84666410719b0a389e37951784dec1d9a93cd8d90dd7703,Will Colorado Rapids SC win on 2026-07-22?,Yes,Direccional,1,102.3349,0.46,0.485,1,1.0,10.116071371832051,swisstony,20.416071371832054,208.4249,2,0.49549549409340043,10.300000000000002,106.09,44.4,49.5,
0x85d7e77f46e92faec56205028d9f5102bc0fd1ca616bc738e5701ef58b8c9eab,Chicago Fire FC vs. Vancouver Whitecaps FC: O/U 2.5,Over,Direccional,1,336.108,0.6595,0.42,1,1.0,18.33324848465214,swisstony,41.2564790597696,861.5825,2,0.4443725907412547,22.92323057511746,525.4745,44.3,44.4,
0x2307c8dd123f120f7d8a890646229f3b0211e182534e925e9604942317b7eddd,Exact Score: Chicago Fire FC 3 - 3 Vancouver Whitecaps FC?,No,Marcador exacto / posible cobertura,1,927.9257,0.9739,0.965,1,1.0,30.46187289054959,swisstony,30.46187289054959,927.9257,1,1.0,0.0,0.0,44.2,100.0,Revisar reglas: un pick NO puede incluir empate o una resolución distinta a clasificación.
0x7beb03b48f520e43ae2e217fefe3a48f6948018d3da07678e22708463789afa0,Exact Score: Chicago Fire FC 3 - 2 Vancouver Whitecaps FC?,No,Marcador exacto / posible cobertura,1,921.6241,0.9583,0.75,1,1.0,30.358262466748652,swisstony,30.358262466748652,921.6241,1,1.0,0.0,0.0,44.2,100.0,Revisar reglas: un pick NO puede incluir empate o una resolución distinta a clasificación.
0x7df2322c3c356efc3d7313e50dc0bff380f559084678b34bcd084f888a85a77d,Hanshin Tigers vs. Yokohama BayStars,Yokohama BayStars,Direccional,1,131.575,0.3001,0.475,1,1.0,11.470614630437202,swisstony,24.463793610194237,300.3977,2,0.46888127055066864,12.993178979757035,168.8227,43.9,46.9,
0xbaaebdf982b987694de4f2dbf4605eead94012ada2c5507167a72102484bbedb,Exact Score: Chicago Fire FC 2 - 2 Vancouver Whitecaps FC?,No,Marcador exacto / posible cobertura,1,567.435,0.91,0.905,1,1.0,23.82089418976542,swisstony,23.82089418976542,567.435,1,1.0,0.0,0.0,43.6,100.0,Revisar reglas: un pick NO puede incluir empate o una resolución distinta a clasificación.
0x841fb7a9055ca17285ff76a882274972b072eda7569d4fe6daef56fa29a8ee6b,Exact Score: Chicago Fire FC 0 - 0 Vancouver Whitecaps FC?,No,Marcador exacto / posible cobertura,1,553.8682,0.9609,0.755,1,1.0,23.534404602623795,swisstony,23.534404602623795,553.8682,1,1.0,0.0,0.0,43.6,100.0,Revisar reglas: un pick NO puede incluir empate o una resolución distinta a clasificación.
0x3a386263109b82a74ab4b1846e4f025f14bcd6c55bacfa834824a68b952fc7bf,Segovia: Akira Santillan vs Mert Alkaya,Akira Santillan,Direccional,1,107.274,0.469,0.4705,1,1.0,10.35731625470614,swisstony,22.083828950303243,244.7851,2,0.46900002160014553,11.726512695597103,137.5111,43.6,46.9,
0x4aa3bbbfcca55802fe284e7f4fd47543832ed089d612311e3f643a6f6f57ff2e,Exact Score: Chicago Fire FC 1 - 1 Vancouver Whitecaps FC?,No,Marcador exacto / posible cobertura,1,518.4375,0.88,0.79,1,1.0,22.76922264812745,swisstony,22.76922264812745,518.4375,1,1.0,0.0,0.0,43.5,100.0,Revisar reglas: un pick NO puede incluir empate o una resolución distinta a clasificación.
0xda9fcfe15a8a3132eb7836193db3cc96ffbf0bdc45943de1e372adee6b0ef214,Exact Score: Chicago Fire FC 0 - 3 Vancouver Whitecaps FC?,No,Marcador exacto / posible cobertura,1,489.1205,0.9699,0.754,1,1.0,22.11606881884753,swisstony,22.11606881884753,489.1205,1,1.0,0.0,0.0,43.4,100.0,Revisar reglas: un pick NO puede incluir empate o una resolución distinta a clasificación.
0x60d0badc8638ae1c41a4506c2205af08e0775b655c83d9abf34ba1a74da9b18c,Exact Score: Chicago Fire FC 1 - 3 Vancouver Whitecaps FC?,No,Marcador exacto / posible cobertura,1,484.2884,0.9467,0.75,1,1.0,22.00655356933475,swisstony,22.00655356933475,484.2884,1,1.0,0.0,0.0,43.4,100.0,Revisar reglas: un pick NO puede incluir empate o una resolución distinta a clasificación.
0x016602d116e9f23e24a554835130f29e68cc7f82a3013f3c50a2ce862a2bdfd6,Will Chicago Fire FC win on 2026-07-16?,Yes,Direccional,1,135.2022,0.3384,0.505,1,1.0,11.627648085490032,swisstony,26.166045521246147,346.5672,2,0.444379265336395,14.538397435756115,211.365,43.2,44.4,
0x55f83890e325bb4c7345346f6a259ce65aebd925a9a1042bde732e48507e162e,Will Atlanta United FC win on 2026-07-22?,No,Direccional,1,157.29,0.7432,0.735,1,1.0,12.541531007018241,swisstony,29.078160046819555,430.7501,2,0.43130414671439915,16.536629039801312,273.4601,43.0,43.1,Revisar reglas: un pick NO puede incluir empate o una resolución distinta a clasificación.
0x5f8572697a9b224cdc73ae44a99a13c4878166e06899e20535b7a0d0859100bb,Spread: Boston Red Sox (-1.5),Baltimore Orioles,Direccional,1,248.2701,0.64,0.59,1,1.0,15.756589097898061,swisstony,38.40699969020301,761.3112000000001,2,0.41025305868704204,22.650410592304947,513.0411000000001,42.9,41.0,
0x7a21369408e97dfa30ef41ab0b1809abea0bb44913ebe50faf4e08eaddf5d750,Exact Score: PFK Levski Sofia 0 - 1 Universitatea Craiova CS?,No,Marcador exacto / posible cobertura,1,296.0,0.91,0.925,3,1.0,17.204650534085253,RN1,17.204650534085253,296.0,1,1.0,0.0,0.0,42.8,100.0,Revisar reglas: un pick NO puede incluir empate o una resolución distinta a clasificación.
0x179ad066e679114cad7149ff50a8e928071b5748dfb7698dae0612d64ed474b5,Generali Open: Jan-Lennard Struff vs Mariano Navone,Mariano Navone,Direccional,1,3374.9844,0.67,0.675,38,0.4,23.237846371813376,jtwyslljy,33.364601046930176,3713.9964999999997,2,0.696482069098544,10.1267546751168,339.0120999999999,42.7,69.6,
0x3ebb3d62e20300aec0695e28d34ace145882b9ccae7af182103a24361f5c5db6,Exact Score: Chicago Fire FC 2 - 1 Vancouver Whitecaps FC?,No,Marcador exacto / posible cobertura,1,217.845,0.91,0.705,1,1.0,14.75957316456001,swisstony,14.75957316456001,217.845,1,1.0,0.0,0.0,42.4,100.0,Revisar reglas: un pick NO puede incluir empate o una resolución distinta a clasificación.
0x869f3f563b57b43b75266a3143f30e01b58528162f25c3a6bbfbc5077b24b234,Zug: Alvaro Guillen Meza vs Anton Matusevich,Anton Matusevich,Direccional,1,223.5102,0.4805,0.415,1,1.0,14.950257522865618,swisstony,37.75691444579056,743.6538,2,0.3959607860523251,22.806656922924937,520.1436000000001,42.3,39.6,
0x44e44f4440467c1b409bfb6f5b9a7d9a42f8f3854993abb3f06d8b359ca31ad7,Exact Score: Chicago Fire FC 0 - 1 Vancouver Whitecaps FC?,No,Marcador exacto / posible cobertura,1,158.7834,0.9393,0.75,1,1.0,12.600928537215026,swisstony,12.600928537215026,158.7834,1,1.0,0.0,0.0,42.0,100.0,Revisar reglas: un pick NO puede incluir empate o una resolución distinta a clasificación.
0xe2e5a1d649c5e71e33323dc6f61aa88d9d656c240a07e774e4a3721056d71b2f,Exact Score: PFK Levski Sofia 2 - 0 Universitatea Craiova CS?,Yes,Marcador exacto / posible cobertura,1,147.05,0.08,0.085,3,1.0,12.126417442921879,RN1,12.126417442921879,147.05,1,1.0,0.0,0.0,42.0,100.0,
0xf330a9c9053053882f094c3cd3dd63984f7a6a32ca94a933eb0094fce730b788,Livesport Prague Open: Marie Bouzkova vs Carol Young Suh Lee,Carol Young Suh Lee,Direccional,1,714.8592,0.1927,0.155,1,1.0,26.73685097388995,swisstony,80.17981019250895,2908.4174,3,0.33346114077466255,53.442959218619,2193.5582,41.9,33.3,
0x8b289fe7332bf7177650563b51c57b93d9e404a85fe24d664ce9537c4c84aece,Will AS Omónoia Leukosías win on 2026-07-22?,No,Direccional,1,136.5,0.44,0.455,3,1.0,11.683321445547923,RN1,29.07171823047321,1136.0250999999998,2,0.4018792887618652,17.388396784925284,999.5250999999998,41.9,40.2,Revisar reglas: un pick NO puede incluir empate o una resolución distinta a clasificación.
0x7453466521ed6a2ef40639e620f9c681d502ea0eb8b04600350dd22162330f6a,Shanghai Haigang FC vs. Dalian Yingbo FC: O/U 1.5,Over,Direccional,1,402.2156,0.8281,0.605,1,1.0,20.05531351038921,swisstony,56.46786903729504,1728.0898,2,0.3551632787336704,36.41255552690583,1325.8742,41.8,35.5,
0xa5e1eec9ea183ebdea91adfa0303bdacc3d7798e11da798467535b1c1764b74d,ITF Bacau: Stefan Ilie Bogdan Petre vs Stefan Adrian Andreescu,Stefan Ilie Bogdan Petre,Direccional,1,222.903,0.3579,0.28,3,1.0,14.929936369589791,RN1,39.937809560722975,767.5233000000001,3,0.37382962495451194,25.007873191133186,544.6203,41.7,37.4,
0xda4d52beb435d244545e9b1e4b051266ce416378ae3f0b9f4a2edf5402acae6a,FC Seoul vs. Pohang Steelers FC: O/U 2.5,Over,Direccional,1,200.4225,0.4133,0.425,1,1.0,14.15706537386898,swisstony,37.83424425987649,761.0313,2,0.3741865511209023,23.67717888600751,560.6088,41.6,37.4,
0x427c61f76fb6c2404cdf72a50b68fd4e9d5a39836e1e0ef063937458dc74abd5,Exact Score: Chicago Fire FC 2 - 3 Vancouver Whitecaps FC?,Yes,Marcador exacto / posible cobertura,1,110.282,0.0389,0.22,1,1.0,10.50152369896864,swisstony,10.50152369896864,110.282,1,1.0,0.0,0.0,41.6,100.0,
0x8b289fe7332bf7177650563b51c57b93d9e404a85fe24d664ce9537c4c84aece,Will AS Omónoia Leukosías win on 2026-07-22?,Yes,Direccional,1,999.5251,0.5669,0.545,28,0.55,17.388396784925288,Wallet 0x076d...8d4c,29.07171823047321,1136.0250999999998,2,0.5981207112381348,11.683321445547922,136.4999999999999,41.3,59.8,
0x198631be68310036030d5988e191c41a3790198d2aee0e9f2032ea68496d78d1,Will Coritiba FBC win on 2026-07-22?,Yes,Direccional,1,453.788,0.2,0.205,1,1.0,21.30230034526788,swisstony,63.878890157041205,2266.554,2,0.33347949992396325,42.576589811773324,1812.766,41.3,33.3,
0xd73b81755d573d5abb591ab049ef6a5c535833296e8b1d3573558b6d12d686fe,Will Vancouver Whitecaps FC win on 2026-07-16?,No,Direccional,1,380.232,0.5848,0.72,1,1.0,19.49953845607634,swisstony,61.70355129845899,2161.4107,2,0.3160197111144773,42.20401284238265,1781.1787,40.6,31.6,Revisar reglas: un pick NO puede incluir empate o una resolución distinta a clasificación.
0xfc20e326d52c24e220a020d6e64a239707b06936e3a5a6c52f559ffab77bba35,Hamburg European Open: Tessa Brockmann vs Elsa Jacquemot,Elsa Jacquemot,Direccional,1,1663.125,0.6204,0.625,1,1.0,40.78142959730568,swisstony,187.54105298162398,14610.999699999998,3,0.2174533466083376,146.7596233843183,12947.874699999998,39.5,21.7,
0xe19ddd7a87ad62801fdd2387d8c1056a7521e11110af4fc009b9189924a01760,Spread: Cleveland Guardians (-1.5),Detroit Tigers,Direccional,1,229.3826,0.6698,0.55,1,1.0,15.14538213449895,swisstony,50.98917099672723,1514.1598,2,0.29703134682207455,35.84378886222828,1284.7772,39.4,29.7,
0xba9987738b849610b4f2e9aa67a07434c891e3e9254dde20aa87af894de74c86,Bucheon FC 1995 vs. FC Anyang: Both Teams to Score,No,Direccional,1,414.5309,0.5124,0.465,1,1.0,20.36003192531878,swisstony,78.5329955768296,3798.6246,2,0.2592544926597173,58.17296365151083,3384.0937000000004,39.0,25.9,Revisar reglas: un pick NO puede incluir empate o una resolución distinta a clasificación.
0x983aafe2560d2e3987a2ecbeb022c364160c03ead3543d607e0aa2313006d2aa,Spread: St. Louis Cardinals (-1.5),Arizona Diamondbacks,Direccional,1,263.587,0.6168,0.665,1,1.0,16.235362638389077,swisstony,71.35757685371246,3302.0455,2,0.22752121574521225,55.12221421532338,3038.4585,37.5,22.8,
0x1af1af3bdc91a70599c5e2301b9b720811d2a09811149dc8301c8f8a0454364f,Spread: FC Anyang (-1.5),FC Anyang,Direccional,1,225.7475,0.1496,0.155,1,1.0,15.024896006295684,swisstony,67.77383248846564,3008.1978,2,0.22169169802892222,52.74893648216996,2782.4503,37.1,22.2,
0x53454b0a76a8d21f8e3fa31285b2d685f5a36f34c708a0c0038c329d803af4e1,Pittsburgh Pirates vs. New York Yankees: O/U 9.5,Under,Direccional,1,175.3922,0.53,0.61,1,1.0,13.243572025703639,swisstony,57.402376357342874,2125.3922000000002,2,0.23071469974098954,44.15880433163923,1950.0000000000002,37.1,23.1,
0xab4b075154272288ff9b05fda69992f921fc1d2f4c1c9d2d680ca48cd6d7cb88,Will Maitland FC win on 2026-07-22?,No,Direccional,1,158.6105,0.5601,0.545,28,0.55,6.926736334667288,Wallet 0x076d...8d4c,12.963561990589447,279.08410000000003,2,0.5343235400652666,6.03682565592216,120.47360000000003,37.1,53.4,Revisar reglas: un pick NO puede incluir empate o una resolución distinta a clasificación.
0xb8d3be712e630ea2de1410089a5f97428c3c649779a3b6c2d2a1d9f78623f4af,Estoril Open: Hugo Gaston vs Titouan Droguet,Hugo Gaston,Direccional,1,394.9674,0.3724,0.405,28,0.55,10.930582715482283,Wallet 0x076d...8d4c,22.223629248637096,522.5003,2,0.49184508044079345,11.293046533154813,127.53290000000004,36.9,49.2,
0xcabd45bbac7facb7980779e2ac69dc1a910829ca3a946b8341ad11b532d9a512,Generali Open: Alex Molcan vs Daniel Altmaier,Daniel Altmaier,Direccional,1,4350.0,0.45,0.435,38,0.4,26.38181191654584,jtwyslljy,54.555819121210504,4959.5332,3,0.4835746642889095,28.174007204664665,609.5331999999999,36.7,48.4,
0x0f5a9a8670cc76629faedf09ed8f64e08b1dad8727b834b31515b01322576b6a,Will FC Seoul win on 2026-07-22?,No,Direccional,1,1886.8471,0.46,0.465,1,1.0,43.43785330791567,swisstony,358.2760475863294,190351.32190000004,3,0.12124129871520081,314.83819427841377,188464.47480000003,36.7,12.1,Revisar reglas: un pick NO puede incluir empate o una resolución distinta a clasificación.
0xde19280b80c138dc958aa7164bea61094e1ee9641adce20a097a16a98c5ce6a5,ITF Ollersbach: Fares Zakaria vs David Bakonyi,David Bakonyi,Direccional,1,459.9201,0.1683,0.065,3,1.0,21.445747830280947,RN1,122.82794453362028,9482.419899999999,3,0.17459990812115925,101.38219670333933,9022.4998,36.6,17.5,
0x6915eebfc4e59a01872275bae229f78a65316401d356f0473848d4a2d178a38e,Will NK Celje win on 2026-07-22?,No,Direccional,1,4458.5238,0.5,0.505,28,0.55,36.724698085893095,Wallet 0x076d...8d4c,96.89230825324145,16425.9331,2,0.37902593867315054,60.16761016734836,11967.4093,36.5,37.9,Revisar reglas: un pick NO puede incluir empate o una resolución distinta a clasificación.
0x29d203f90b02392439bb3f919af6bee4589c747ed655e05a89fdfa274404a828,Will Charlotte FC win on 2026-07-22?,Yes,Direccional,1,315.5995,0.4934,0.475,1,1.0,17.765120320448155,swisstony,97.75189809965366,21465.6313,2,0.181736832387003,79.98677777920551,21150.0318,36.3,18.2,
0x97b66d987b63b438af6467bf15ede9f2845b857dadf44653b262fc5a6a699411,Will SE Palmeiras win on 2026-07-22?,No,Direccional,1,122.1359,0.479,0.485,1,1.0,11.051511208879989,swisstony,58.85679857335464,2407.4814,2,0.18776949267986817,47.80528736447465,2285.3455,35.4,18.8,Revisar reglas: un pick NO puede incluir empate o una resolución distinta a clasificación.
0xab4b075154272288ff9b05fda69992f921fc1d2f4c1c9d2d680ca48cd6d7cb88,Will Maitland FC win on 2026-07-22?,Yes,Direccional,1,120.4736,0.4572,0.455,28,0.55,6.036825655922159,Wallet 0x076d...8d4c,12.963561990589447,279.08410000000003,2,0.46567645993473333,6.9267363346672886,158.61050000000003,34.7,46.6,
0xf8502b19a602d80ac7694be67144bb1f30626fbabd6332251125874a7454edf7,Generali Open: Marco Trungelliti vs Yannick Hanfmann,Marco Trungelliti,Direccional,1,2759.2,0.35,0.3449,38,0.4,21.011235089827537,jtwyslljy,51.054370745081634,3661.79,2,0.41154625516272125,30.043135655254098,902.5900000000001,33.9,41.2,
0xe45c9f437b3ddaca31655aa195a4cbab13b41b1a6ab272841314d4397b003261,ITF Ollersbach: Patrik Homola vs Bor Artnak,Patrik Homola,Direccional,1,116.1449,0.014,0.0155,3,1.0,10.777054328525955,RN1,77.33833782403157,3784.7522,3,0.1393494433905091,66.56128349550562,3668.6072999999997,33.8,13.9,
0x055ae2ce1a9d54d1230b0ec51a3ba2c872544209e3dcc98d38fa2b0453fa278f,Will PFK Levski Sofia win on 2026-07-22?,No,Direccional,1,5364.3189,0.529,0.525,28,0.55,40.282830923980505,Wallet 0x076d...8d4c,148.8880188355139,28344.803099999997,3,0.27055790814493624,108.60518791153339,22980.4842,33.5,27.1,Revisar reglas: un pick NO puede incluir empate o una resolución distinta a clasificación.
0x90ccd5a711854279acb4bfea911c0ef952c54d1d32e7db793047ff11d017295e,KBO: LG Twins vs. Samsung Lions,Samsung Lions,Direccional,1,208.6024,0.4725,0.485,30,0.55,7.943690955720773,ndb1,20.640639408006464,369.81489999999997,2,0.38485682534812515,12.696948452285692,161.21249999999998,32.9,38.5,
0x115aa58e9b29210f2f1a6ccffa7d8f6cd1832175f5219f06d16ca4004f5a4d4b,Hamburg European Open: Maria Lourdes Carle vs Anhelina Kalinina,Maria Lourdes Carle,Direccional,1,107.263,0.0732,0.0075,3,1.0,10.35678521550003,RN1,184.25729435091378,17162.5883,3,0.05620827795167648,173.90050913541376,17055.3253,31.2,5.6,
0x179ad066e679114cad7149ff50a8e928071b5748dfb7698dae0612d64ed474b5,Generali Open: Jan-Lennard Struff vs Mariano Navone,Jan-Lennard Struff,Direccional,1,339.0121,0.3499,0.325,28,0.55,10.126754675116802,Wallet 0x076d...8d4c,33.364601046930176,3713.9964999999997,2,0.30351793090145607,23.237846371813376,3374.9844,31.1,30.4,
0xf194634652d8dbdb464a85ef173ca2d037cc6d488d547da4b56aace7b5b3a6ec,Will Bohemian FC win on 2026-07-22?,No,Direccional,1,170.4046,0.4399,0.445,28,0.55,7.179651210191203,Wallet 0x076d...8d4c,33.47665529810966,2456.4622,2,0.21446739963286054,26.29700408791846,2286.0576,27.6,21.4,Revisar reglas: un pick NO puede incluir empate o una resolución distinta a clasificación.
0xfa086a518e7f6045b17e542de8fbab13f20b19fbbbcf05c3e26e78540c48b38d,Generali Open: Kilian Feldbausch vs Ignacio Buse,Kilian Feldbausch,Direccional,1,169.2186,0.3569,0.3205,28,0.55,7.154622736385197,Wallet 0x076d...8d4c,46.42786133882475,1874.8045,3,0.15410192350174504,39.27323860243955,1705.5859,25.7,15.4,
